type,id,title,authors,date,primary_category,pdf_url,preference,abstract
arxiv,2504.17565,DeepDistill: Enhancing LLM Reasoning Capabilities via Large-Scale Difficulty-Graded Data Training,Xiaoyu Tian; Sitong Zhao; Haotian Wang; Shuaiting Chen; Yiping Peng; Yunjie Ji; Han Zhao; Xiangang Li,2025-04-24T13:57:53+00:00,cs.CL,http://arxiv.org/pdf/2504.17565v2,like,"Although large language models (LLMs) have recently achieved remarkable performance on various complex reasoning benchmarks, the academic community still lacks an in-depth understanding of base model training processes and data quality. To address this, we construct a large-scale, difficulty-graded reasoning dataset containing approximately 3.34 million unique queries of varying difficulty levels and about 40 million distilled responses generated by multiple models over several passes. Leveraging pass rate and Coefficient of Variation (CV), we precisely select the most valuable training data to enhance reasoning capability. Notably, we observe a training pattern shift, indicating that reasoning-focused training based on base models requires higher learning rates for effective training. Using this carefully selected data, we significantly improve the reasoning capabilities of the base model, achieving a pass rate of 79.2\% on the AIME2024 mathematical reasoning benchmark. This result surpasses most current distilled models and closely approaches state-of-the-art performance. We provide detailed descriptions of our data processing, difficulty assessment, and training methodology, and have publicly released all datasets and methods to promote rapid progress in open-source long-reasoning LLMs. The dataset is available at: https://huggingface.co/datasets/a-m-team/AM-DeepSeek-Distilled-40M"
arxiv,2409.14846,A-VL: Adaptive Attention for Large Vision-Language Models,Junyang Zhang; Mu Yuan; Ruiguang Zhong; Puhan Luo; Huiyou Zhan; Ningkang Zhang; Chengchen Hu; Xiangyang Li,2024-09-23T09:22:59+00:00,cs.AI,http://arxiv.org/pdf/2409.14846v2,dislike,"The Large Vision-Language Model (LVLM) integrates computer vision and natural language processing techniques, offering substantial application potential. However, these models demand extensive resources during inference. Adaptive attention techniques can dynamically reduce computational redundancy and thus improve efficiency. Although current adaptive attention methods significantly reduce the memory requirements of Transformer-based language models, they are not tailored for LVLMs. We observe that LVLMs generate responses from both remote image tokens and local text tokens, and different modalities have different attention patterns. This observation inspires us to manage the attention for each modality separately. Specifically, for visual input, we store the cache of potentially useful information but only compute the most critical parts. For language input, we care more about local information. Based on our observation and analysis of vision-language attention patterns, we develop A-VL, a plug-and-play adaptive attention tailored for LVLM inference. Extensive evaluations on three vision-language tasks and five datasets show the effectiveness of our designs. Our approach A-VL outperforms existing adaptive attention methods in reducing memory usage and computational load without compromising performance."
arxiv,2504.13818,Not All Rollouts are Useful: Down-Sampling Rollouts in LLM Reinforcement Learning,Yixuan Even Xu; Yash Savani; Fei Fang; Zico Kolter,2025-04-18T17:49:55+00:00,cs.LG,http://arxiv.org/pdf/2504.13818v1,like,"Reinforcement learning (RL) has emerged as a powerful paradigm for enhancing reasoning capabilities in large language models, but faces a fundamental asymmetry in computation and memory requirements: inference is embarrassingly parallel with a minimal memory footprint, while policy updates require extensive synchronization and are memory-intensive. To address this asymmetry, we introduce PODS (Policy Optimization with Down-Sampling), a framework that strategically decouples these phases by generating numerous rollouts in parallel but updating only on an informative subset. Within this framework, we develop max-variance down-sampling, a theoretically motivated method that selects rollouts with maximally diverse reward signals. We prove that this approach has an efficient algorithmic solution, and empirically demonstrate that GRPO with PODS using max-variance down-sampling achieves superior performance over standard GRPO on the GSM8K benchmark."
arxiv,2410.17195,Non-myopic Generation of Language Models for Reasoning and Planning,Chang Ma; Haiteng Zhao; Junlei Zhang; Junxian He; Lingpeng Kong,2024-10-22T17:13:38+00:00,cs.AI,http://arxiv.org/pdf/2410.17195v3,like,"Large Language Models have demonstrated remarkable abilities in reasoning and planning by breaking down complex problems into sequential steps. Despite their success in various domains like mathematical problem-solving and coding, LLMs face challenges in ensuring reliable and optimal planning due to their inherent myopic nature of autoregressive decoding. This paper revisits LLM reasoning from an optimal-control perspective, proposing a novel method, Predictive-Decoding, that leverages Model Predictive Control to enhance planning accuracy. By re-weighting LLM distributions based on foresight trajectories, Predictive-Decoding aims to mitigate early errors and promote non-myopic planning. Our experiments show significant improvements in a wide range of tasks for math, coding, and agents. Furthermore, Predictive-Decoding demonstrates computational efficiency, outperforming search baselines with reduced computational resources. This study provides insights into optimizing LLM planning capabilities."
arxiv,2104.09864,RoFormer: Enhanced Transformer with Rotary Position Embedding,Jianlin Su; Yu Lu; Shengfeng Pan; Ahmed Murtadha; Bo Wen; Yunfeng Liu,2021-04-20T09:54:06+00:00,cs.CL,http://arxiv.org/pdf/2104.09864v5,like,"Position encoding recently has shown effective in the transformer architecture. It enables valuable supervision for dependency modeling between elements at different positions of the sequence. In this paper, we first investigate various methods to integrate positional information into the learning process of transformer-based language models. Then, we propose a novel method named Rotary Position Embedding(RoPE) to effectively leverage the positional information. Specifically, the proposed RoPE encodes the absolute position with a rotation matrix and meanwhile incorporates the explicit relative position dependency in self-attention formulation. Notably, RoPE enables valuable properties, including the flexibility of sequence length, decaying inter-token dependency with increasing relative distances, and the capability of equipping the linear self-attention with relative position encoding. Finally, we evaluate the enhanced transformer with rotary position embedding, also called RoFormer, on various long text classification benchmark datasets. Our experiments show that it consistently overcomes its alternatives. Furthermore, we provide a theoretical analysis to explain some experimental results. RoFormer is already integrated into Huggingface: \url{https://huggingface.co/docs/transformers/model_doc/roformer}."
arxiv,2406.17808,Training-Free Exponential Context Extension via Cascading KV Cache,Jeffrey Willette; Heejun Lee; Youngwan Lee; Myeongjae Jeon; Sung Ju Hwang,2024-06-24T03:59:17+00:00,cs.CL,http://arxiv.org/pdf/2406.17808v4,dislike,"The transformer's context window is vital for tasks such as few-shot learning and conditional generation as it preserves previous tokens for active memory. However, as the context lengths increase, the computational costs grow quadratically, hindering the deployment of large language models (LLMs) in real-world, long sequence scenarios. Although some recent key-value caching (KV Cache) methods offer linear inference complexity, they naively manage the stored context, prematurely evicting tokens and losing valuable information. Moreover, they lack an optimized prefill/prompt stage strategy, resulting in higher latency than even quadratic attention for realistic context sizes. In response, we introduce a novel mechanism that leverages cascading sub-cache buffers to selectively retain the most relevant tokens, enabling the model to maintain longer context histories without increasing the cache size. Our approach outperforms linear caching baselines across key benchmarks, including streaming perplexity, question answering, book summarization, and passkey retrieval, where it retains better retrieval accuracy at 1M tokens after four doublings of the cache size of 65K. Additionally, our method reduces prefill stage latency by a factor of 6.8 when compared to flash attention on 1M tokens. These innovations not only enhance the computational efficiency of LLMs but also pave the way for their effective deployment in resource-constrained environments, enabling large-scale, real-time applications with significantly reduced latency."
arxiv,2504.16795,Random Long-Context Access for Mamba via Hardware-aligned Hierarchical Sparse Attention,Xiang Hu; Jiaqi Leng; Jun Zhao; Kewei Tu; Wei Wu,2025-04-23T15:15:06+00:00,cs.CL,http://arxiv.org/pdf/2504.16795v1,dislike,"A key advantage of Recurrent Neural Networks (RNNs) over Transformers is their linear computational and space complexity enables faster training and inference for long sequences. However, RNNs are fundamentally unable to randomly access historical context, and simply integrating attention mechanisms may undermine their efficiency advantages. To overcome this limitation, we propose \textbf{H}ierarchical \textbf{S}parse \textbf{A}ttention (HSA), a novel attention mechanism that enhances RNNs with long-range random access flexibility while preserving their merits in efficiency and length generalization. HSA divides inputs into chunks, selecting the top-$k$ chunks and hierarchically aggregates information. The core innovation lies in learning token-to-chunk relevance based on fine-grained token-level information inside each chunk. This approach enhances the precision of chunk selection across both in-domain and out-of-domain context lengths. To make HSA efficient, we further introduce a hardware-aligned kernel design. By combining HSA with Mamba, we introduce RAMba, which achieves perfect accuracy in passkey retrieval across 64 million contexts despite pre-training on only 4K-length contexts, and significant improvements on various downstream tasks, with nearly constant memory footprint. These results show RAMba's huge potential in long-context modeling."
arxiv,2504.13752,Learning to Attribute with Attention,Benjamin Cohen-Wang; Yung-Sung Chuang; Aleksander Madry,2025-04-18T15:36:28+00:00,cs.LG,http://arxiv.org/pdf/2504.13752v1,like,"Given a sequence of tokens generated by a language model, we may want to identify the preceding tokens that influence the model to generate this sequence. Performing such token attribution is expensive; a common approach is to ablate preceding tokens and directly measure their effects. To reduce the cost of token attribution, we revisit attention weights as a heuristic for how a language model uses previous tokens. Naive approaches to attribute model behavior with attention (e.g., averaging attention weights across attention heads to estimate a token's influence) have been found to be unreliable. To attain faithful attributions, we propose treating the attention weights of different attention heads as features. This way, we can learn how to effectively leverage attention weights for attribution (using signal from ablations). Our resulting method, Attribution with Attention (AT2), reliably performs on par with approaches that involve many ablations, while being significantly more efficient. To showcase the utility of AT2, we use it to prune less important parts of a provided context in a question answering setting, improving answer quality. We provide code for AT2 at https://github.com/MadryLab/AT2 ."
arxiv,2312.04528,Using Large Language Models for Hyperparameter Optimization,Michael R. Zhang; Nishkrit Desai; Juhan Bae; Jonathan Lorraine; Jimmy Ba,2023-12-07T18:46:50+00:00,cs.LG,http://arxiv.org/pdf/2312.04528v2,dislike,"This paper explores the use of foundational large language models (LLMs) in hyperparameter optimization (HPO). Hyperparameters are critical in determining the effectiveness of machine learning models, yet their optimization often relies on manual approaches in limited-budget settings. By prompting LLMs with dataset and model descriptions, we develop a methodology where LLMs suggest hyperparameter configurations, which are iteratively refined based on model performance. Our empirical evaluations on standard benchmarks reveal that within constrained search budgets, LLMs can match or outperform traditional HPO methods like Bayesian optimization across different models on standard benchmarks. Furthermore, we propose to treat the code specifying our model as a hyperparameter, which the LLM outputs and affords greater flexibility than existing HPO approaches."
arxiv,2410.14731,MatryoshkaKV: Adaptive KV Compression via Trainable Orthogonal Projection,Bokai Lin; Zihao Zeng; Zipeng Xiao; Siqi Kou; Tianqi Hou; Xiaofeng Gao; Hao Zhang; Zhijie Deng,2024-10-16T08:34:51+00:00,cs.LG,http://arxiv.org/pdf/2410.14731v1,like,"KV cache has become a de facto technique for the inference of large language models (LLMs), where tensors of shape (layer number, head number, sequence length, feature dimension) are introduced to cache historical information for self-attention. As the size of the model and data grows, the KV cache can quickly become a bottleneck within the system in both storage and memory transfer. To address this, prior studies usually focus on the first three axes of the cache tensors for compression. This paper supplements them, focusing on the feature dimension axis, by utilizing low-rank projection matrices to transform the cache features into spaces with reduced dimensions. We begin by investigating the canonical orthogonal projection method for data compression through principal component analysis (PCA). We observe the issue with PCA projection where significant performance degradation is observed at low compression rates. To bridge the gap, we propose to directly tune the orthogonal projection matrices with a distillation objective using an elaborate Matryoshka training strategy. After training, we adaptively search for the optimal compression rates for various layers and heads given varying compression budgets. Compared to previous works, our method can easily embrace pre-trained LLMs and hold a smooth tradeoff between performance and compression rate. We empirically witness the high data efficiency of our training procedure and find that our method can sustain over 90% performance with an average KV cache compression rate of 60% (and up to 75% in certain extreme scenarios) for popular LLMs like LLaMA2-7B-base and Mistral-7B-v0.3-base."
arxiv,2406.0212,MVAD: A Multiple Visual Artifact Detector for Video Streaming,Chen Feng; Duolikun Danier; Fan Zhang; Alex Mackin; Andrew Collins; David Bull,2024-05-31T21:56:04+00:00,eess.IV,http://arxiv.org/pdf/2406.00212v2,dislike,"Visual artifacts are often introduced into streamed video content, due to prevailing conditions during content production and delivery. Since these can degrade the quality of the user's experience, it is important to automatically and accurately detect them in order to enable effective quality measurement and enhancement. Existing detection methods often focus on a single type of artifact and/or determine the presence of an artifact through thresholding objective quality indices. Such approaches have been reported to offer inconsistent prediction performance and are also impractical for real-world applications where multiple artifacts co-exist and interact. In this paper, we propose a Multiple Visual Artifact Detector, MVAD, for video streaming which, for the first time, is able to detect multiple artifacts using a single framework that is not reliant on video quality assessment models. Our approach employs a new Artifact-aware Dynamic Feature Extractor (ADFE) to obtain artifact-relevant spatial features within each frame for multiple artifact types. The extracted features are further processed by a Recurrent Memory Vision Transformer (RMViT) module, which captures both short-term and long-term temporal information within the input video. The proposed network architecture is optimized in an end-to-end manner based on a new, large and diverse training database that is generated by simulating the video streaming pipeline and based on Adversarial Data Augmentation. This model has been evaluated on two video artifact databases, Maxwell and BVI-Artifact, and achieves consistent and improved prediction results for ten target visual artifacts when compared to seven existing single and multiple artifact detectors. The source code and training database will be available at https://chenfeng-bristol.github.io/MVAD/."
arxiv,2407.00075,Logicbreaks: A Framework for Understanding Subversion of Rule-based Inference,Anton Xue; Avishree Khare; Rajeev Alur; Surbhi Goel; Eric Wong,2024-06-21T19:18:16+00:00,cs.AI,http://arxiv.org/pdf/2407.00075v5,like,"We study how to subvert large language models (LLMs) from following prompt-specified rules. We first formalize rule-following as inference in propositional Horn logic, a mathematical system in which rules have the form ""if $P$ and $Q$, then $R$"" for some propositions $P$, $Q$, and $R$. Next, we prove that although small transformers can faithfully follow such rules, maliciously crafted prompts can still mislead both theoretical constructions and models learned from data. Furthermore, we demonstrate that popular attack algorithms on LLMs find adversarial prompts and induce attention patterns that align with our theory. Our novel logic-based framework provides a foundation for studying LLMs in rule-based settings, enabling a formal analysis of tasks like logical reasoning and jailbreak attacks."
arxiv,2403.0159,Chow Künneth decomposition for étale motives,Ivan Rosas-Soto,2024-02-29T22:22:38+00:00,math.AG,http://arxiv.org/pdf/2403.00159v1,dislike,"In the present article we define an integral analogue of Chow-K\""unneth decomposition for \'etale motives. By using families of conservative functors we are able to establish a decomposition of the \'etale motive of commutative group schemes over a base and we relate to an integral \'etale Chow-K\""unneth decomposition of abelian varieties. For a projective variety $X$ of dimension $d$ over an algebraically closed field, we construct integral sub-motives $h^1_{\text{\'et}}(X)$ and $h^{2d-1}_{\text{\'et}}(X)$ of the motive $h_{\text{\'et}}(X)$."
arxiv,2504.13822,Parameter-Efficient Continual Fine-Tuning: A Survey,Eric Nuertey Coleman; Luigi Quarantiello; Ziyue Liu; Qinwen Yang; Samrat Mukherjee; Julio Hurtado; Vincenzo Lomonaco,2025-04-18T17:51:51+00:00,cs.LG,http://arxiv.org/pdf/2504.13822v1,like,"The emergence of large pre-trained networks has revolutionized the AI field, unlocking new possibilities and achieving unprecedented performance. However, these models inherit a fundamental limitation from traditional Machine Learning approaches: their strong dependence on the \textit{i.i.d.} assumption hinders their adaptability to dynamic learning scenarios. We believe the next breakthrough in AI lies in enabling efficient adaptation to evolving environments -- such as the real world -- where new data and tasks arrive sequentially. This challenge defines the field of Continual Learning (CL), a Machine Learning paradigm focused on developing lifelong learning neural models. One alternative to efficiently adapt these large-scale models is known Parameter-Efficient Fine-Tuning (PEFT). These methods tackle the issue of adapting the model to a particular data or scenario by performing small and efficient modifications, achieving similar performance to full fine-tuning. However, these techniques still lack the ability to adjust the model to multiple tasks continually, as they suffer from the issue of Catastrophic Forgetting. In this survey, we first provide an overview of CL algorithms and PEFT methods before reviewing the state-of-the-art on Parameter-Efficient Continual Fine-Tuning (PECFT). We examine various approaches, discuss evaluation metrics, and explore potential future research directions. Our goal is to highlight the synergy between CL and Parameter-Efficient Fine-Tuning, guide researchers in this field, and pave the way for novel future research directions."
arxiv,2409.05816,Improving Pretraining Data Using Perplexity Correlations,Tristan Thrush; Christopher Potts; Tatsunori Hashimoto,2024-09-09T17:23:29+00:00,cs.CL,http://arxiv.org/pdf/2409.05816v2,dislike,"Quality pretraining data is often seen as the key to high-performance language models. However, progress in understanding pretraining data has been slow due to the costly pretraining runs required for data selection experiments. We present a framework that avoids these costs and selects high-quality pretraining data without any LLM training of our own. Our work is based on a simple observation: LLM losses on many pretraining texts are correlated with downstream benchmark performance, and selecting high-correlation documents is an effective pretraining data selection method. We build a new statistical framework for data selection centered around estimates of perplexity-benchmark correlations and perform data selection using a sample of 90 LLMs taken from the Open LLM Leaderboard on texts from tens of thousands of web domains. In controlled pretraining experiments at the 160M parameter scale on 8 benchmarks, our approach outperforms DSIR on every benchmark, while matching the best data selector found in DataComp-LM, a hand-engineered bigram classifier. We have now also updated this paper to include results from preregistered experiments with new pretraining data on an aggregation of 22 benchmarks up to the 1.4B scale, showing increasing improvements of our method over others with more scale. A pip package with full documentation can be found here: https://github.com/TristanThrush/perplexity-correlations."
arxiv,2410.19572,ChunkRAG: Novel LLM-Chunk Filtering Method for RAG Systems,Ishneet Sukhvinder Singh; Ritvik Aggarwal; Ibrahim Allahverdiyev; Muhammad Taha; Aslihan Akalin; Kevin Zhu; Sean O'Brien,2024-10-25T14:07:53+00:00,cs.CL,http://arxiv.org/pdf/2410.19572v5,dislike,"Retrieval-Augmented Generation (RAG) systems using large language models (LLMs) often generate inaccurate responses due to the retrieval of irrelevant or loosely related information. Existing methods, which operate at the document level, fail to effectively filter out such content. We propose LLM-driven chunk filtering, ChunkRAG, a framework that enhances RAG systems by evaluating and filtering retrieved information at the chunk level. Our approach employs semantic chunking to divide documents into coherent sections and utilizes LLM-based relevance scoring to assess each chunk's alignment with the user's query. By filtering out less pertinent chunks before the generation phase, we significantly reduce hallucinations and improve factual accuracy. Experiments show that our method outperforms existing RAG models, achieving higher accuracy on tasks requiring precise information retrieval. This advancement enhances the reliability of RAG systems, making them particularly beneficial for applications like fact-checking and multi-hop reasoning."
arxiv,2409.20089,Robust LLM safeguarding via refusal feature adversarial training,Lei Yu; Virginie Do; Karen Hambardzumyan; Nicola Cancedda,2024-09-30T08:41:39+00:00,cs.LG,http://arxiv.org/pdf/2409.20089v2,dislike,"Large language models (LLMs) are vulnerable to adversarial attacks that can elicit harmful responses. Defending against such attacks remains challenging due to the opacity of jailbreaking mechanisms and the high computational cost of training LLMs robustly. We demonstrate that adversarial attacks share a universal mechanism for circumventing LLM safeguards that works by ablating a dimension in the residual stream embedding space called the refusal feature. We further show that the operation of refusal feature ablation (RFA) approximates the worst-case perturbation of offsetting model safety. Based on these findings, we propose Refusal Feature Adversarial Training (ReFAT), a novel algorithm that efficiently performs LLM adversarial training by simulating the effect of input-level attacks via RFA. Experiment results show that ReFAT significantly improves the robustness of three popular LLMs against a wide range of adversarial attacks, with considerably less computational overhead compared to existing adversarial training methods."
arxiv,2504.16312,Capturing Symmetry and Antisymmetry in Language Models through Symmetry-Aware Training Objectives,Zhangdie Yuan; Andreas Vlachos,2025-04-22T23:11:50+00:00,cs.CL,http://arxiv.org/pdf/2504.16312v1,dislike,"Capturing symmetric (e.g., country borders another country) and antisymmetric (e.g., parent_of) relations is crucial for a variety of applications. This paper tackles this challenge by introducing a novel Wikidata-derived natural language inference dataset designed to evaluate large language models (LLMs). Our findings reveal that LLMs perform comparably to random chance on this benchmark, highlighting a gap in relational understanding. To address this, we explore encoder retraining via contrastive learning with k-nearest neighbors. The retrained encoder matches the performance of fine-tuned classification heads while offering additional benefits, including greater efficiency in few-shot learning and improved mitigation of catastrophic forgetting."
