type,id,title,authors,date,primary_category,pdf_url,preference,abstract
arxiv,2410.1285,Enhancing Training Data Attribution for Large Language Models with Fitting Error Consideration,Kangxi Wu; Liang Pang; Huawei Shen; Xueqi Cheng,2024-10-02T07:14:26+00:00,cs.CL,http://arxiv.org/pdf/2410.01285v2,like,"The black-box nature of large language models (LLMs) poses challenges in interpreting results, impacting issues such as data intellectual property protection and hallucination tracing. Training data attribution (TDA) methods are considered effective solutions to address these challenges. Most recent TDA methods rely on influence functions, assuming the model achieves minimized empirical risk. However, achieving this criterion is difficult, and sourcing accuracy can be compromised by fitting errors during model training. In this paper, we introduce a novel TDA method called Debias and Denoise Attribution (DDA), which enhances influence functions by addressing fitting errors. Specifically, the debias strategy seeks to improve the performance of influence functions by eliminating the knowledge bias present in the base model before fine-tuning, while the denoise strategy aims to reduce discrepancies in influence scores arising from varying degrees of fitting during the training process through smoothing techniques. Experimental results demonstrate that our method significantly outperforms existing approaches, achieving an averaged AUC of 91.64%. Moreover, DDA exhibits strong generality and scalability across various sources and different-scale models like LLaMA2, QWEN2, and Mistral."
arxiv,2408.05646,Eigen Attention: Attention in Low-Rank Space for KV Cache Compression,Utkarsh Saxena; Gobinda Saha; Sakshi Choudhary; Kaushik Roy,2024-08-10T22:47:12+00:00,cs.LG,http://arxiv.org/pdf/2408.05646v2,like,"Large language models (LLMs) represent a groundbreaking advancement in the domain of natural language processing due to their impressive reasoning abilities. Recently, there has been considerable interest in increasing the context lengths for these models to enhance their applicability to complex tasks. However, at long context lengths and large batch sizes, the key-value (KV) cache, which stores the attention keys and values, emerges as the new bottleneck in memory usage during inference. To address this, we propose Eigen Attention, which performs the attention operation in a low-rank space, thereby reducing the KV cache memory overhead. Our proposed approach is orthogonal to existing KV cache compression techniques and can be used synergistically with them. Through extensive experiments over OPT, MPT, and Llama model families, we demonstrate that Eigen Attention results in up to 40% reduction in KV cache sizes and up to 60% reduction in attention operation latency with minimal drop in performance. Code is available at https://github.com/UtkarshSaxena1/EigenAttn."
arxiv,2410.23214,Grounding by Trying: LLMs with Reinforcement Learning-Enhanced Retrieval,Sheryl Hsu; Omar Khattab; Chelsea Finn; Archit Sharma,2024-10-30T17:02:54+00:00,cs.LG,http://arxiv.org/pdf/2410.23214v2,like,"The hallucinations of large language models (LLMs) are increasingly mitigated by allowing LLMs to search for information and to ground their answers in real sources. Unfortunately, LLMs often struggle with posing the right search queries, especially when dealing with complex or otherwise indirect topics. Observing that LLMs can learn to search for relevant facts by $\textit{trying}$ different queries and learning to up-weight queries that successfully produce relevant results, we introduce $\underline{Le}$arning to $\underline{Re}$trieve by $\underline{T}$rying (LeReT), a reinforcement learning framework that explores search queries and uses preference-based optimization to improve their quality. LeReT can improve the absolute retrieval accuracy by up to 29% and the downstream generator evaluations by 17%. The simplicity and flexibility of LeReT allows it to be applied to arbitrary off-the-shelf retrievers and makes it a promising technique for improving general LLM pipelines. Project website: http://sherylhsu.com/LeReT/."
arxiv,2312.03732,A Rank Stabilization Scaling Factor for Fine-Tuning with LoRA,Damjan Kalajdzievski,2023-11-28T03:23:20+00:00,cs.CL,http://arxiv.org/pdf/2312.03732v1,like,"As large language models (LLMs) have become increasingly compute and memory intensive, parameter-efficient fine-tuning (PEFT) methods are now a common strategy to fine-tune LLMs. A popular PEFT method is Low-Rank Adapters (LoRA), which adds trainable low-rank ""adapters"" to selected layers. Each adapter consists of a low-rank matrix product, multiplicatively scaled by a rank-dependent factor. This scaling factor, which divides adapters by a factor of the rank, results in slowed learning and stunted performance for LoRA with higher-rank adapters. Consequently, the use of LoRA in practice has generally been limited to very low ranks. In this work, we study the impact of the scaling factor on the learning process and prove that LoRA adapters should be divided by a factor of the square root of the rank. Modifying LoRA with the appropriate scaling factor, which we call the rank-stabilized LoRA (rsLoRA) method, easily provides for a fine-tuning compute/performance trade-off, where larger ranks can be used to trade off increased computational resources during training for better fine-tuning performance, with no change in inference computing cost."
arxiv,2307.13365,Pay Attention to What You Need,Yifei Gao; Shaohong Chen; Lei Wang; Ruiting Dai; Ziyun Zhang; Kerui Ren; Jiaji Wu; Jun Cheng,2023-07-25T09:34:42+00:00,cs.CL,http://arxiv.org/pdf/2307.13365v3,like,"Although large language models (LLMs) have achieved significant success in natural language processing, they still struggle with long-context comprehension. Traditional approaches to mitigating this issue typically rely on fine-tuning or retraining, which is both resource-intensive and challenging to deploy in lightweight industrial settings. In this paper, we investigate the potential to accomplish this without any additional resources. Through an in-depth study of the attention mechanism in LLMs, we propose a method called Scaled ReAttention (SRA) to strengthen LLMs' ability to interpret and retrieve information by strategically manipulating their attention scores during inference. Through extensive experiments, we demonstrate that integrating SRA significantly boosts LLMs' performance on a variety of downstream tasks, highlighting its practical potential for enhancing language understanding without incurring the overhead of traditional training."
arxiv,2502.13533,"Train Small, Infer Large: Memory-Efficient LoRA Training for Large Language Models",Jun Zhang; Jue Wang; Huan Li; Lidan Shou; Ke Chen; Yang You; Guiming Xie; Xuejian Gong; Kunlong Zhou,2025-02-19T08:39:15+00:00,cs.LG,http://arxiv.org/pdf/2502.13533v2,like,"Large Language Models (LLMs) have significantly advanced natural language processing with exceptional task generalization capabilities. Low-Rank Adaption (LoRA) offers a cost-effective fine-tuning solution, freezing the original model parameters and training only lightweight, low-rank adapter matrices. However, the memory footprint of LoRA is largely dominated by the original model parameters. To mitigate this, we propose LoRAM, a memory-efficient LoRA training scheme founded on the intuition that many neurons in over-parameterized LLMs have low training utility but are essential for inference. LoRAM presents a unique twist: it trains on a pruned (small) model to obtain pruned low-rank matrices, which are then recovered and utilized with the original (large) model for inference. Additionally, minimal-cost continual pre-training, performed by the model publishers in advance, aligns the knowledge discrepancy between pruned and original models. Our extensive experiments demonstrate the efficacy of LoRAM across various pruning strategies and downstream tasks. For a model with 70 billion parameters, LoRAM enables training on a GPU with only 20G HBM, replacing an A100-80G GPU for LoRA training and 15 GPUs for full fine-tuning. Specifically, QLoRAM implemented by structured pruning combined with 4-bit quantization, for LLaMA-3.1-70B (LLaMA-2-70B), reduces the parameter storage cost that dominates the memory usage in low-rank matrix training by 15.81$\times$ (16.95$\times$), while achieving dominant performance gains over both the original LLaMA-3.1-70B (LLaMA-2-70B) and LoRA-trained LLaMA-3.1-8B (LLaMA-2-13B). Code is available at https://github.com/junzhang-zj/LoRAM."
arxiv,2410.10254,LoLCATs: On Low-Rank Linearizing of Large Language Models,Michael Zhang; Simran Arora; Rahul Chalamala; Alan Wu; Benjamin Spector; Aaryan Singhal; Krithik Ramesh; Christopher Ré,2024-10-14T08:10:34+00:00,cs.LG,http://arxiv.org/pdf/2410.10254v3,like,"Recent works show we can linearize large language models (LLMs) -- swapping the quadratic attentions of popular Transformer-based LLMs with subquadratic analogs, such as linear attention -- avoiding the expensive pretraining costs. However, linearizing LLMs often significantly degrades model quality, still requires training over billions of tokens, and remains limited to smaller 1.3B to 7B LLMs. We thus propose Low-rank Linear Conversion via Attention Transfer (LoLCATs), a simple two-step method that improves LLM linearizing quality with orders of magnitudes less memory and compute. We base these steps on two findings. First, we can replace an LLM's softmax attentions with closely-approximating linear attentions, simply by training the linear attentions to match their softmax counterparts with an output MSE loss (""attention transfer""). Then, this enables adjusting for approximation errors and recovering LLM quality simply with low-rank adaptation (LoRA). LoLCATs significantly improves linearizing quality, training efficiency, and scalability. We significantly reduce the linearizing quality gap and produce state-of-the-art subquadratic LLMs from Llama 3 8B and Mistral 7B v0.1, leading to 20+ points of improvement on 5-shot MMLU. Furthermore, LoLCATs does so with only 0.2% of past methods' model parameters and 0.4% of their training tokens. Finally, we apply LoLCATs to create the first linearized 70B and 405B LLMs (50x larger than prior work). When compared with prior approaches under the same compute budgets, LoLCATs significantly improves linearizing quality, closing the gap between linearized and original Llama 3.1 70B and 405B LLMs by 77.8% and 78.1% on 5-shot MMLU."
arxiv,2502.0579,Intrinsic Random Functions and Parametric Covariance Models of Spatio-Temporal Random Processes on the Sphere,Jongwook Kim; Chunfeng Huang; Nicholas Bussberg,2025-02-01T22:15:55+00:00,stat.ME,http://arxiv.org/pdf/2502.00579v1,like,"Identifying an appropriate covariance function is one of the primary interests in spatial and spatio-temporal statistics because it allows researchers to analyze the dependence structure of the random process. For this purpose, spatial homogeneity and temporal stationarity are widely used assumptions, and many parametric covariance models have been developed under these assumptions. However, these are strong and unrealistic conditions in many cases. In addition, on the sphere, although different statistical approaches from those on Euclidean space should be applied to build a proper covariance model considering its unique characteristics, relevant studies are rare. In this research, we introduce novel parameterized models of the covariance function for spatially non-homogeneous and temporally non-stationary random processes on the sphere. To alleviate the spatial homogeneity assumption and temporal stationarity, and to consider the spherical domain and time domain together, this research will apply the theories of Intrinsic Random Functions (IRF). We also provide a methodology to estimate the associated parameters for the model. Finally, through a simulation study and analysis of a real-world data set about global temperature anomaly, we demonstrate validity of the suggested covariance model with its advantage of interpretability."
arxiv,2006.04768,Linformer: Self-Attention with Linear Complexity,Sinong Wang; Belinda Z. Li; Madian Khabsa; Han Fang; Hao Ma,2020-06-08T17:37:52+00:00,cs.LG,http://arxiv.org/pdf/2006.04768v3,like,"Large transformer models have shown extraordinary success in achieving state-of-the-art results in many natural language processing applications. However, training and deploying these models can be prohibitively costly for long sequences, as the standard self-attention mechanism of the Transformer uses $O(n^2)$ time and space with respect to sequence length. In this paper, we demonstrate that the self-attention mechanism can be approximated by a low-rank matrix. We further exploit this finding to propose a new self-attention mechanism, which reduces the overall self-attention complexity from $O(n^2)$ to $O(n)$ in both time and space. The resulting linear transformer, the \textit{Linformer}, performs on par with standard Transformer models, while being much more memory- and time-efficient."
arxiv,2501.15225,SEAL: Scaling to Emphasize Attention for Long-Context Retrieval,Changhun Lee; Jun-gyu Jin; Younghyun Cho; Eunhyeok Park,2025-01-25T14:09:39+00:00,cs.CL,http://arxiv.org/pdf/2501.15225v1,like,"In this work, we introduce a novel approach called Scaling to Emphasize Attention for Long-context retrieval (SEAL), which enhances the retrieval performance of large language models (LLMs) over extended contexts. Previous studies have shown that each attention head in LLMs has a unique functionality and collectively contributes to the overall behavior of the model. Similarly, we observe that specific heads are closely tied to long-context retrieval, showing positive or negative correlation with retrieval scores. Built on this insight, we propose a learning-based mechanism using zero-shot generated data to emphasize these heads, improving the model's performance in long-context retrieval tasks. By applying SEAL, we can achieve significant improvements in in-domain retrieval performance, including document QA tasks from LongBench, and considerable improvements in out-of-domain cases. Additionally, when combined with existing training-free context extension techniques, SEAL extends the context limits of LLMs while maintaining highly reliable outputs, opening new avenues for research in this field."
arxiv,2304.11062,Scaling Transformer to 1M tokens and beyond with RMT,Aydar Bulatov; Yuri Kuratov; Yermek Kapushev; Mikhail S. Burtsev,2023-04-19T16:18:54+00:00,cs.CL,http://arxiv.org/pdf/2304.11062v2,dislike,"A major limitation for the broader scope of problems solvable by transformers is the quadratic scaling of computational complexity with input size. In this study, we investigate the recurrent memory augmentation of pre-trained transformer models to extend input context length while linearly scaling compute. Our approach demonstrates the capability to store information in memory for sequences of up to an unprecedented two million tokens while maintaining high retrieval accuracy. Experiments with language modeling tasks show perplexity improvement as the number of processed input segments increases. These results underscore the effectiveness of our method, which has significant potential to enhance long-term dependency handling in natural language understanding and generation tasks, as well as enable large-scale context processing for memory-intensive applications."
arxiv,2411.07641,Top-$nσ$: Not All Logits Are You Need,Chenxia Tang; Jianchun Liu; Hongli Xu; Liusheng Huang,2024-11-12T08:46:43+00:00,cs.LG,http://arxiv.org/pdf/2411.07641v1,like,"Large language models (LLMs) typically employ greedy decoding or low-temperature sampling for reasoning tasks, reflecting a perceived trade-off between diversity and accuracy. We challenge this convention by introducing top-$n\sigma$, a novel sampling method that operates directly on pre-softmax logits by leveraging a statistical threshold. Our key insight is that logits naturally separate into a Gaussian-distributed noisy region and a distinct informative region, enabling efficient token filtering without complex probability manipulations. Unlike existing methods (e.g., top-$p$, min-$p$) that inadvertently include more noise tokens at higher temperatures, top-$n\sigma$ maintains a stable sampling space regardless of temperature scaling. We also provide a theoretical analysis of top-$n\sigma$ to better understand its behavior. The extensive experimental results across four reasoning-focused datasets demonstrate that our method not only outperforms existing sampling approaches but also surpasses greedy decoding, while maintaining consistent performance even at high temperatures."
arxiv,2503.04355,Layer-Specific Scaling of Positional Encodings for Superior Long-Context Modeling,Zhenghua Wang; Yiran Ding; Changze Lv; Zhibo Xu; Tianlong Li; Tianyuan Shi; Xiaoqing Zheng; Xuanjing Huang,2025-03-06T11:59:55+00:00,cs.CL,http://arxiv.org/pdf/2503.04355v1,like,"Although large language models (LLMs) have achieved significant progress in handling long-context inputs, they still suffer from the ``lost-in-the-middle'' problem, where crucial information in the middle of the context is often underrepresented or lost. Our extensive experiments reveal that this issue may arise from the rapid long-term decay in Rotary Position Embedding (RoPE). To address this problem, we propose a layer-specific positional encoding scaling method that assigns distinct scaling factors to each layer, slowing down the decay rate caused by RoPE to make the model pay more attention to the middle context. A specially designed genetic algorithm is employed to efficiently select the optimal scaling factors for each layer by incorporating Bezier curves to reduce the search space. Through comprehensive experimentation, we demonstrate that our method significantly alleviates the ``lost-in-the-middle'' problem. Our approach results in an average accuracy improvement of up to 20% on the Key-Value Retrieval dataset. Furthermore, we show that layer-specific interpolation, as opposed to uniform interpolation across all layers, enhances the model's extrapolation capabilities when combined with PI and Dynamic-NTK positional encoding schemes."
arxiv,2504.15777,Tina: Tiny Reasoning Models via LoRA,Shangshang Wang; Julian Asilis; Ömer Faruk Akgül; Enes Burak Bilgin; Ollie Liu; Willie Neiswanger,2025-04-22T10:38:00+00:00,cs.CL,http://arxiv.org/pdf/2504.15777v1,like,"How cost-effectively can strong reasoning abilities be achieved in language models? Driven by this fundamental question, we present Tina, a family of tiny reasoning models achieved with high cost-efficiency. Notably, Tina demonstrates that substantial reasoning performance can be developed using only minimal resources, by applying parameter-efficient updates during reinforcement learning (RL), using low-rank adaptation (LoRA), to an already tiny 1.5B parameter base model. This minimalist approach produces models that achieve reasoning performance which is competitive with, and sometimes surpasses, SOTA RL reasoning models built upon the same base model. Crucially, this is achieved at a tiny fraction of the computational post-training cost employed by existing SOTA models. In fact, the best Tina model achieves a >20\% reasoning performance increase and 43.33\% Pass@1 accuracy on AIME24, at only \$9 USD post-training and evaluation cost (i.e., an estimated 260x cost reduction). Our work reveals the surprising effectiveness of efficient RL reasoning via LoRA. We validate this across multiple open-source reasoning datasets and various ablation settings starting with a single, fixed set of hyperparameters. Furthermore, we hypothesize that this effectiveness and efficiency stem from LoRA rapidly adapting the model to the structural format of reasoning rewarded by RL, while largely preserving the base model's underlying knowledge. In service of accessibility and open research, we fully open-source all code, training logs, and model weights \& checkpoints."
arxiv,2306.05176,RRWKV: Capturing Long-range Dependencies in RWKV,Leilei Wang,2023-06-08T13:17:06+00:00,cs.CL,http://arxiv.org/pdf/2306.05176v4,like,"Owing to the impressive dot-product attention, the Transformers have been the dominant architectures in various natural language processing (NLP) tasks. Recently, the Receptance Weighted Key Value (RWKV) architecture follows a non-transformer architecture to eliminate the drawbacks of dot-product attention, where memory and computational complexity exhibits quadratic scaling with sequence length. Although RWKV has exploited a linearly tensor-product attention mechanism and achieved parallelized computations by deploying the time-sequential mode, it fails to capture long-range dependencies because of its limitation on looking back at previous information, compared with full information obtained by direct interactions in the standard transformer. Therefore, the paper devises the Retrospected Receptance Weighted Key Value (RRWKV) architecture via incorporating the retrospecting ability into the RWKV to effectively absorb information, which maintains memory and computational efficiency as well."
arxiv,2404.04522,Q-PEFT: Query-dependent Parameter Efficient Fine-tuning for Text Reranking with Large Language Models,Zhiyuan Peng; Xuyang Wu; Qifan Wang; Sravanthi Rajanala; Yi Fang,2024-04-06T06:44:41+00:00,cs.CL,http://arxiv.org/pdf/2404.04522v2,like,"Parameter Efficient Fine-Tuning (PEFT) methods have been extensively utilized in Large Language Models (LLMs) to improve the down-streaming tasks without the cost of fine-tuing the whole LLMs. Recent studies have shown how to effectively use PEFT for fine-tuning LLMs in ranking tasks with convincing performance; there are some limitations, including the learned prompt being fixed for different documents, overfitting to specific tasks, and low adaptation ability. In this paper, we introduce a query-dependent parameter efficient fine-tuning (Q-PEFT) approach for text reranking to leak the information of the true queries to LLMs and then make the generation of true queries from input documents much easier. Specifically, we utilize the query to extract the top-$k$ tokens from concatenated documents, serving as contextual clues. We further augment Q-PEFT by substituting the retrieval mechanism with a multi-head attention layer to achieve end-to-end training and cover all the tokens in the documents, guiding the LLMs to generate more document-specific synthetic queries, thereby further improving the reranking performance. Extensive experiments are conducted on four public datasets, demonstrating the effectiveness of our proposed approach."
arxiv,2406.10251,The Impact of Quantization on Retrieval-Augmented Generation: An Analysis of Small LLMs,Mert Yazan; Suzan Verberne; Frederik Situmeang,2024-06-10T08:23:52+00:00,cs.CL,http://arxiv.org/pdf/2406.10251v3,like,"Post-training quantization reduces the computational demand of Large Language Models (LLMs) but can weaken some of their capabilities. Since LLM abilities emerge with scale, smaller LLMs are more sensitive to quantization. In this paper, we explore how quantization affects smaller LLMs' ability to perform retrieval-augmented generation (RAG), specifically in longer contexts. We chose personalization for evaluation because it is a challenging domain to perform using RAG as it requires long-context reasoning over multiple documents. We compare the original FP16 and the quantized INT4 performance of multiple 7B and 8B LLMs on two tasks while progressively increasing the number of retrieved documents to test how quantized models fare against longer contexts. To better understand the effect of retrieval, we evaluate three retrieval models in our experiments. Our findings reveal that if a 7B LLM performs the task well, quantization does not impair its performance and long-context reasoning capabilities. We conclude that it is possible to utilize RAG with quantized smaller LLMs."
