type,id,title,authors,date,primary_category,pdf_url,preference,abstract
arxiv,2501.17039,Enhanced Retrieval of Long Documents: Leveraging Fine-Grained Block Representations with Large Language Models,Minghan Li; Eric Gaussier; Guodong Zhou,2025-01-28T16:03:52+00:00,cs.IR,http://arxiv.org/pdf/2501.17039v1,like,"In recent years, large language models (LLMs) have demonstrated exceptional power in various domains, including information retrieval. Most of the previous practices involve leveraging these models to create a single embedding for each query, each passage, or each document individually, a strategy exemplified and used by the Retrieval-Augmented Generation (RAG) framework. While this method has proven effective, we argue that it falls short in fully capturing the nuanced intricacies of document-level texts due to its reliance on a relatively coarse-grained representation. To address this limitation, we introduce a novel, fine-grained approach aimed at enhancing the accuracy of relevance scoring for long documents. Our methodology firstly segments a long document into blocks, each of which is embedded using an LLM, for matching with the query representation. When calculating the relevance score, we aggregate the query-block relevance scores through a weighted sum method, yielding a comprehensive score for the query with the entire document. Despite its apparent simplicity, our experimental findings reveal that this approach outperforms standard representation methods and achieves a significant reduction in embedding generation latency. Moreover, by carefully optimizing pairwise loss functions, superior performances have been achieved."
arxiv,2407.02694,LLM-Select: Feature Selection with Large Language Models,Daniel P. Jeong; Zachary C. Lipton; Pradeep Ravikumar,2024-07-02T22:23:40+00:00,cs.LG,http://arxiv.org/pdf/2407.02694v2,like,"In this paper, we demonstrate a surprising capability of large language models (LLMs): given only input feature names and a description of a prediction task, they are capable of selecting the most predictive features, with performance rivaling the standard tools of data science. Remarkably, these models exhibit this capacity across various query mechanisms. For example, we zero-shot prompt an LLM to output a numerical importance score for a feature (e.g., ""blood pressure"") in predicting an outcome of interest (e.g., ""heart failure""), with no additional context. In particular, we find that the latest models, such as GPT-4, can consistently identify the most predictive features regardless of the query mechanism and across various prompting strategies. We illustrate these findings through extensive experiments on real-world data, where we show that LLM-based feature selection consistently achieves strong performance competitive with data-driven methods such as the LASSO, despite never having looked at the downstream training data. Our findings suggest that LLMs may be useful not only for selecting the best features for training but also for deciding which features to collect in the first place. This could benefit practitioners in domains like healthcare and the social sciences, where collecting high-quality data comes at a high cost."
arxiv,2504.12459,On Linear Representations and Pretraining Data Frequency in Language Models,Jack Merullo; Noah A. Smith; Sarah Wiegreffe; Yanai Elazar,2025-04-16T19:50:03+00:00,cs.CL,http://arxiv.org/pdf/2504.12459v1,like,"Pretraining data has a direct impact on the behaviors and quality of language models (LMs), but we only understand the most basic principles of this relationship. While most work focuses on pretraining data's effect on downstream task behavior, we investigate its relationship to LM representations. Previous work has discovered that, in language models, some concepts are encoded `linearly' in the representations, but what factors cause these representations to form? We study the connection between pretraining data frequency and models' linear representations of factual relations. We find evidence that the formation of linear representations is strongly connected to pretraining term frequencies; specifically for subject-relation-object fact triplets, both subject-object co-occurrence frequency and in-context learning accuracy for the relation are highly correlated with linear representations. This is the case across all phases of pretraining. In OLMo-7B and GPT-J, we discover that a linear representation consistently (but not exclusively) forms when the subjects and objects within a relation co-occur at least 1k and 2k times, respectively, regardless of when these occurrences happen during pretraining. Finally, we train a regression model on measurements of linear representation quality in fully-trained LMs that can predict how often a term was seen in pretraining. Our model achieves low error even on inputs from a different model with a different pretraining dataset, providing a new method for estimating properties of the otherwise-unknown training data of closed-data models. We conclude that the strength of linear representations in LMs contains signal about the models' pretraining corpora that may provide new avenues for controlling and improving model behavior: particularly, manipulating the models' training data to meet specific frequency thresholds."
arxiv,2407.0945,Efficient Expert Pruning for Sparse Mixture-of-Experts Language Models: Enhancing Performance and Reducing Inference Costs,Enshu Liu; Junyi Zhu; Zinan Lin; Xuefei Ning; Matthew B. Blaschko; Shengen Yan; Guohao Dai; Huazhong Yang; Yu Wang,2024-07-01T03:57:35+00:00,cs.LG,http://arxiv.org/pdf/2407.00945v1,like,"The rapid advancement of large language models (LLMs) has led to architectures with billions to trillions of parameters, posing significant deployment challenges due to their substantial demands on memory, processing power, and energy consumption. Sparse Mixture-of-Experts (SMoE) architectures have emerged as a solution, activating only a subset of parameters per token, thereby achieving faster inference while maintaining performance. However, SMoE models still face limitations in broader deployment due to their large parameter counts and significant GPU memory requirements. In this work, we introduce a gradient-free evolutionary strategy named EEP (Efficient Expert P}runing) to enhance the pruning of experts in SMoE models. EEP relies solely on model inference (i.e., no gradient computation) and achieves greater sparsity while maintaining or even improving performance on downstream tasks. EEP can be used to reduce both the total number of experts (thus saving GPU memory) and the number of active experts (thus accelerating inference). For example, we demonstrate that pruning up to 75% of experts in Mixtral $8\times7$B-Instruct results in a substantial reduction in parameters with minimal performance loss. Remarkably, we observe improved performance on certain tasks, such as a significant increase in accuracy on the SQuAD dataset (from 53.4% to 75.4%), when pruning half of the experts. With these results, EEP not only lowers the barrier to deploying SMoE models,but also challenges the conventional understanding of model pruning by showing that fewer experts can lead to better task-specific performance without any fine-tuning. Code is available at https://github.com/imagination-research/EEP."
arxiv,2504.05343,AROMA: Autonomous Rank-one Matrix Adaptation,Hao Nan Sheng; Zhi-yong Wang; Mingrui Yang; Hing Cheung So,2025-04-06T09:14:43+00:00,cs.LG,http://arxiv.org/pdf/2504.05343v2,dislike,"As large language models continue to grow in size, parameter-efficient fine-tuning (PEFT) has become increasingly crucial. While low-rank adaptation (LoRA) offers a solution through low-rank updates, its static rank allocation may yield suboptimal results. Adaptive low-rank adaptation (AdaLoRA) improves this with dynamic allocation but remains sensitive to initial and target rank configurations. We introduce AROMA, a framework that automatically constructs layer-specific updates by iteratively building up rank-one components with very few trainable parameters that gradually diminish to zero. Unlike existing methods that employ rank reduction mechanisms, AROMA introduces a dual-loop architecture for rank growth. The inner loop extracts information from each rank-one subspace, while the outer loop determines the number of rank-one subspaces, i.e., the optimal rank. We reset optimizer states to maintain subspace independence. AROMA significantly reduces parameters compared to LoRA and AdaLoRA while achieving superior performance on natural language understanding and commonsense reasoning tasks, offering new insights into adaptive PEFT. The code is available at \href{https://github.com/ShuDun23/AROMA}{AROMA}."
arxiv,2504.15208,Compute-Optimal LLMs Provably Generalize Better With Scale,Marc Finzi; Sanyam Kapoor; Diego Granziol; Anming Gu; Christopher De Sa; J. Zico Kolter; Andrew Gordon Wilson,2025-04-21T16:26:56+00:00,cs.LG,http://arxiv.org/pdf/2504.15208v1,like,"Why do larger language models generalize better? To investigate this question, we develop generalization bounds on the pretraining objective of large language models (LLMs) in the compute-optimal regime, as described by the Chinchilla scaling laws. We introduce a novel, fully empirical Freedman-type martingale concentration inequality that tightens existing bounds by accounting for the variance of the loss function. This generalization bound can be decomposed into three interpretable components: the number of parameters per token, the loss variance, and the quantization error at a fixed bitrate. As compute-optimal language models are scaled up, the number of parameters per data point remains constant; however, both the loss variance and the quantization error decrease, implying that larger models should have smaller generalization gaps. We examine why larger models tend to be more quantizable from an information theoretic perspective, showing that the rate at which they can integrate new information grows more slowly than their capacity on the compute-optimal frontier. From these findings we produce a scaling law for the generalization gap, with bounds that become predictably stronger with scale."
arxiv,2504.13644,Exploring the Potential for Large Language Models to Demonstrate Rational Probabilistic Beliefs,Gabriel Freedman; Francesca Toni,2025-04-18T11:50:30+00:00,cs.AI,http://arxiv.org/pdf/2504.13644v1,like,"Advances in the general capabilities of large language models (LLMs) have led to their use for information retrieval, and as components in automated decision systems. A faithful representation of probabilistic reasoning in these models may be essential to ensure trustworthy, explainable and effective performance in these tasks. Despite previous work suggesting that LLMs can perform complex reasoning and well-calibrated uncertainty quantification, we find that current versions of this class of model lack the ability to provide rational and coherent representations of probabilistic beliefs. To demonstrate this, we introduce a novel dataset of claims with indeterminate truth values and apply a number of well-established techniques for uncertainty quantification to measure the ability of LLM's to adhere to fundamental properties of probabilistic reasoning."
arxiv,2504.16379,SplitReason: Learning To Offload Reasoning,Yash Akhauri; Anthony Fei; Chi-Chih Chang; Ahmed F. AbouElhamayed; Yueying Li; Mohamed S. Abdelfattah,2025-04-23T03:00:02+00:00,cs.CL,http://arxiv.org/pdf/2504.16379v1,like,"Reasoning in large language models (LLMs) tends to produce substantially longer token generation sequences than simpler language modeling tasks. This extended generation length reflects the multi-step, compositional nature of reasoning and is often correlated with higher solution accuracy. From an efficiency perspective, longer token generation exacerbates the inherently sequential and memory-bound decoding phase of LLMs. However, not all parts of this expensive reasoning process are equally difficult to generate. We leverage this observation by offloading only the most challenging parts of the reasoning process to a larger, more capable model, while performing most of the generation with a smaller, more efficient model; furthermore, we teach the smaller model to identify these difficult segments and independently trigger offloading when needed. To enable this behavior, we annotate difficult segments across 18k reasoning traces from the OpenR1-Math-220k chain-of-thought (CoT) dataset. We then apply supervised fine-tuning (SFT) and reinforcement learning fine-tuning (RLFT) to a 1.5B-parameter reasoning model, training it to learn to offload the most challenging parts of its own reasoning process to a larger model. This approach improves AIME24 reasoning accuracy by 24% and 28.3% while offloading 1.35% and 5% of the generated tokens respectively. We open-source our SplitReason model, data, code and logs."
arxiv,2504.16871,Exploring How LLMs Capture and Represent Domain-Specific Knowledge,Mirian Hipolito Garcia; Camille Couturier; Daniel Madrigal Diaz; Ankur Mallick; Anastasios Kyrillidis; Robert Sim; Victor Ruhle; Saravan Rajmohan,2025-04-23T16:46:06+00:00,cs.LG,http://arxiv.org/pdf/2504.16871v2,like,"We study whether Large Language Models (LLMs) inherently capture domain-specific nuances in natural language. Our experiments probe the domain sensitivity of LLMs by examining their ability to distinguish queries from different domains using hidden states generated during the prefill phase. We reveal latent domain-related trajectories that indicate the model's internal recognition of query domains. We also study the robustness of these domain representations to variations in prompt styles and sources. Our approach leverages these representations for model selection, mapping the LLM that best matches the domain trace of the input query (i.e., the model with the highest performance on similar traces). Our findings show that LLMs can differentiate queries for related domains, and that the fine-tuned model is not always the most accurate. Unlike previous work, our interpretations apply to both closed and open-ended generative tasks"
arxiv,2504.16053,LongMamba: Enhancing Mamba's Long Context Capabilities via Training-Free Receptive Field Enlargement,Zhifan Ye; Kejing Xia; Yonggan Fu; Xin Dong; Jihoon Hong; Xiangchi Yuan; Shizhe Diao; Jan Kautz; Pavlo Molchanov; Yingyan Celine Lin,2025-04-22T17:30:36+00:00,cs.CL,http://arxiv.org/pdf/2504.16053v1,like,"State space models (SSMs) have emerged as an efficient alternative to Transformer models for language modeling, offering linear computational complexity and constant memory usage as context length increases. However, despite their efficiency in handling long contexts, recent studies have shown that SSMs, such as Mamba models, generally underperform compared to Transformers in long-context understanding tasks. To address this significant shortfall and achieve both efficient and accurate long-context understanding, we propose LongMamba, a training-free technique that significantly enhances the long-context capabilities of Mamba models. LongMamba builds on our discovery that the hidden channels in Mamba can be categorized into local and global channels based on their receptive field lengths, with global channels primarily responsible for long-context capability. These global channels can become the key bottleneck as the input context lengthens. Specifically, when input lengths largely exceed the training sequence length, global channels exhibit limitations in adaptively extend their receptive fields, leading to Mamba's poor long-context performance. The key idea of LongMamba is to mitigate the hidden state memory decay in these global channels by preventing the accumulation of unimportant tokens in their memory. This is achieved by first identifying critical tokens in the global channels and then applying token filtering to accumulate only those critical tokens. Through extensive benchmarking across synthetic and real-world long-context scenarios, LongMamba sets a new standard for Mamba's long-context performance, significantly extending its operational range without requiring additional training. Our code is available at https://github.com/GATECH-EIC/LongMamba."
arxiv,2210.15191,Truncation Sampling as Language Model Desmoothing,John Hewitt; Christopher D. Manning; Percy Liang,2022-10-27T05:52:35+00:00,cs.CL,http://arxiv.org/pdf/2210.15191v1,like,"Long samples of text from neural language models can be of poor quality. Truncation sampling algorithms--like top-$p$ or top-$k$ -- address this by setting some words' probabilities to zero at each step. This work provides framing for the aim of truncation, and an improved algorithm for that aim. We propose thinking of a neural language model as a mixture of a true distribution and a smoothing distribution that avoids infinite perplexity. In this light, truncation algorithms aim to perform desmoothing, estimating a subset of the support of the true distribution. Finding a good subset is crucial: we show that top-$p$ unnecessarily truncates high-probability words, for example causing it to truncate all words but Trump for a document that starts with Donald. We introduce $\eta$-sampling, which truncates words below an entropy-dependent probability threshold. Compared to previous algorithms, $\eta$-sampling generates more plausible long English documents according to humans, is better at breaking out of repetition, and behaves more reasonably on a battery of test distributions."
arxiv,2504.15965,From Human Memory to AI Memory: A Survey on Memory Mechanisms in the Era of LLMs,Yaxiong Wu; Sheng Liang; Chen Zhang; Yichao Wang; Yongyue Zhang; Huifeng Guo; Ruiming Tang; Yong Liu,2025-04-22T15:05:04+00:00,cs.IR,http://arxiv.org/pdf/2504.15965v2,like,"Memory is the process of encoding, storing, and retrieving information, allowing humans to retain experiences, knowledge, skills, and facts over time, and serving as the foundation for growth and effective interaction with the world. It plays a crucial role in shaping our identity, making decisions, learning from past experiences, building relationships, and adapting to changes. In the era of large language models (LLMs), memory refers to the ability of an AI system to retain, recall, and use information from past interactions to improve future responses and interactions. Although previous research and reviews have provided detailed descriptions of memory mechanisms, there is still a lack of a systematic review that summarizes and analyzes the relationship between the memory of LLM-driven AI systems and human memory, as well as how we can be inspired by human memory to construct more powerful memory systems. To achieve this, in this paper, we propose a comprehensive survey on the memory of LLM-driven AI systems. In particular, we first conduct a detailed analysis of the categories of human memory and relate them to the memory of AI systems. Second, we systematically organize existing memory-related work and propose a categorization method based on three dimensions (object, form, and time) and eight quadrants. Finally, we illustrate some open problems regarding the memory of current AI systems and outline possible future directions for memory in the era of large language models."
arxiv,2412.15287,Inference-Aware Fine-Tuning for Best-of-N Sampling in Large Language Models,Yinlam Chow; Guy Tennenholtz; Izzeddin Gur; Vincent Zhuang; Bo Dai; Sridhar Thiagarajan; Craig Boutilier; Rishabh Agarwal; Aviral Kumar; Aleksandra Faust,2024-12-18T20:43:47+00:00,cs.CL,http://arxiv.org/pdf/2412.15287v1,dislike,"Recent studies have indicated that effectively utilizing inference-time compute is crucial for attaining better performance from large language models (LLMs). In this work, we propose a novel inference-aware fine-tuning paradigm, in which the model is fine-tuned in a manner that directly optimizes the performance of the inference-time strategy. We study this paradigm using the simple yet effective Best-of-N (BoN) inference strategy, in which a verifier selects the best out of a set of LLM-generated responses. We devise the first imitation learning and reinforcement learning~(RL) methods for BoN-aware fine-tuning, overcoming the challenging, non-differentiable argmax operator within BoN. We empirically demonstrate that our BoN-aware models implicitly learn a meta-strategy that interleaves best responses with more diverse responses that might be better suited to a test-time input -- a process reminiscent of the exploration-exploitation trade-off in RL. Our experiments demonstrate the effectiveness of BoN-aware fine-tuning in terms of improved performance and inference-time compute. In particular, we show that our methods improve the Bo32 performance of Gemma 2B on Hendrycks MATH from 26.8% to 30.8%, and pass@32 from 60.0% to 67.0%, as well as the pass@16 on HumanEval from 61.6% to 67.1%."
arxiv,2411.07635,Breaking the Low-Rank Dilemma of Linear Attention,Qihang Fan; Huaibo Huang; Ran He,2024-11-12T08:30:59+00:00,cs.CV,http://arxiv.org/pdf/2411.07635v5,like,"The Softmax attention mechanism in Transformer models is notoriously computationally expensive, particularly due to its quadratic complexity, posing significant challenges in vision applications. In contrast, linear attention provides a far more efficient solution by reducing the complexity to linear levels. However, compared to Softmax attention, linear attention often experiences significant performance degradation. Our experiments indicate that this performance drop is due to the low-rank nature of linear attention's feature map, which hinders its ability to adequately model complex spatial information. In this paper, to break the low-rank dilemma of linear attention, we conduct rank analysis from two perspectives: the KV buffer and the output features. Consequently, we introduce Rank-Augmented Linear Attention (RALA), which rivals the performance of Softmax attention while maintaining linear complexity and high efficiency. Based on RALA, we construct the Rank-Augmented Vision Linear Transformer (RAVLT). Extensive experiments demonstrate that RAVLT achieves excellent performance across various vision tasks. Specifically, without using any additional labels, data, or supervision during training, RAVLT achieves an 84.4% Top-1 accuracy on ImageNet-1k with only 26M parameters and 4.6G FLOPs. This result significantly surpasses previous linear attention mechanisms, fully illustrating the potential of RALA. Code will be available at https://github.com/qhfan/RALA."
arxiv,2504.15477,In-context Ranking Preference Optimization,Junda Wu; Rohan Surana; Zhouhang Xie; Yiran Shen; Yu Xia; Tong Yu; Ryan A. Rossi; Prithviraj Ammanabrolu; Julian McAuley,2025-04-21T23:06:12+00:00,cs.LG,http://arxiv.org/pdf/2504.15477v1,like,"Recent developments in Direct Preference Optimization (DPO) allow large language models (LLMs) to function as implicit ranking models by maximizing the margin between preferred and non-preferred responses. In practice, user feedback on such lists typically involves identifying a few relevant items in context rather than providing detailed pairwise comparisons for every possible item pair. Moreover, many complex information retrieval tasks, such as conversational agents and summarization systems, critically depend on ranking the highest-quality outputs at the top, emphasizing the need to support natural and flexible forms of user feedback. To address the challenge of limited and sparse pairwise feedback in the in-context setting, we propose an In-context Ranking Preference Optimization (IRPO) framework that directly optimizes LLMs based on ranking lists constructed during inference. To further capture flexible forms of feedback, IRPO extends the DPO objective by incorporating both the relevance of items and their positions in the list. Modeling these aspects jointly is non-trivial, as ranking metrics are inherently discrete and non-differentiable, making direct optimization difficult. To overcome this, IRPO introduces a differentiable objective based on positional aggregation of pairwise item preferences, enabling effective gradient-based optimization of discrete ranking metrics. We further provide theoretical insights showing that IRPO (i) automatically emphasizes items with greater disagreement between the model and the reference ranking, and (ii) links its gradient to an importance sampling estimator, yielding an unbiased estimator with reduced variance. Empirical results show IRPO outperforms standard DPO approaches in ranking performance, highlighting its effectiveness in aligning LLMs with direct in-context ranking preferences."
