type,id,title,authors,date,primary_category,pdf_url,preference,abstract
arxiv,2407.11239,From GaLore to WeLore: How Low-Rank Weights Non-uniformly Emerge from Low-Rank Gradients,Ajay Jaiswal; Lu Yin; Zhenyu Zhang; Shiwei Liu; Jiawei Zhao; Yuandong Tian; Zhangyang Wang,2024-07-15T21:05:20+00:00,cs.LG,http://arxiv.org/pdf/2407.11239v1,like,"Modern Large Language Models (LLMs) are composed of matrices with billions of elements, making their storage and processing quite demanding in terms of computational resources and memory usage. Being significantly large, such matrices can often be expressed in low-rank format with potential to relax resource requirements. Unlike prior works which focus on developing novel matrix decomposition algorithms, in this work we first study the emergence of low-rank structures across matrices within different layers of LLMs and establish a consequential relationship between the gradient dynamics and emerging low-rank expressiveness of matrices. Our findings reveal that different layers exhibit varying levels of converged low-rank structure, necessitating a non-uniform rank reduction across them to minimize performance drop due to compression. In view of that, we present Weight Low-Rank Projection (WeLore) that unifies weight compression and memory-efficient fine-tuning as ONE, in a data-agnostic and one-shot way. WeLore capitalizes the heavy-tail distribution of singular values to identify a suitable rank reduction ratio for matrices within LLMs. Going beyond only as a compression technique, WeLore categorizes weight matrices into Low-rank Components (LRCs) and Non-Low-rank Components (N-LRCs) based on their ability to express themselves as low-rank. Our gradient perspective and extensive experiments illustrate that LRCs tend to have better finetuning capabilities and can closely mimic (sometimes outperform) the training loss trajectory and performance of full-finetuning with notable memory and compute footprint reduction. For example, finetuning a 50\% compressed LLaMa-2 7B model using only a fraction of parameters in LRCs (WeLore) can outperform its full finetuning with ~3x better throughput and ~0.6x GPU requirement. Our codes are available at \url{https://github.com/VITA-Group/welore}"
arxiv,2406.1874,Pionic transitions of the spin-2 partner of $X(3872)$ to $χ_{cJ}$,Shi-Dong Liu; Fan Wang; Zhao-Sai Jia; Gang Li; Xiao-Hai Liu; Ju-Jun Xie,2024-06-04T01:03:37+00:00,hep-ph,http://arxiv.org/pdf/2406.01874v2,like,"We investigated the pionic transitions between the $X_2$ [spin-2 partner of the $X(3872)$] and $\chi_{c1,2}$ using a nonrelativistic effective field theory. The $X_2$ is assumed to be a bound state of the $D^{*}$ and $\bar{D}^*$ mesons and to decay through several kinds of loops, including the bubble, triangle and box loops. Within the present model, the widths for the single-pion decays $X_2\to\pi^0\chi_{cJ}$ are predicted to be about $3$--$30$ keV. For the dipion decays, the widths are a few keVs. These widths yield a branching fraction of $10^{-3}$--$10^{-2}$. The ratio $R_{\mathrm{c}0}=\Gamma (X_2\to\pi^+\pi^-\chi_{cJ})/\Gamma (X_2\to\pi^0\pi^0\chi_{cJ}) \simeq 1.6$, which is a bit smaller than the expected value of $2$, and $R_{21}=\Gamma (X_2\to\pi\pi\chi_{c2})/\Gamma (X_2\to\pi\pi\chi_{c1}) \simeq 0.85$. These ratios are nearly independent of the $X_2$ mass and the coupling constants, which might be a good quantity for the experiments. Moreover, the invariant mass spectra of the $\pi^0\chi_{cJ}$ final state for the dipion processes are presented, showing a cusp structure at the $D {\bar D}^*$ threshold enhanced and narrowed by the nearby triangle singularity."
arxiv,2504.14047,"Think Deep, Think Fast: Investigating Efficiency of Verifier-free Inference-time-scaling Methods",Junlin Wang; Shang Zhu; Jon Saad-Falcon; Ben Athiwaratkun; Qingyang Wu; Jue Wang; Shuaiwen Leon Song; Ce Zhang; Bhuwan Dhingra; James Zou,2025-04-18T19:32:55+00:00,cs.AI,http://arxiv.org/pdf/2504.14047v1,like,"There is intense interest in investigating how inference time compute (ITC) (e.g. repeated sampling, refinements, etc) can improve large language model (LLM) capabilities. At the same time, recent breakthroughs in reasoning models, such as Deepseek-R1, unlock the opportunity for reinforcement learning to improve LLM reasoning skills. An in-depth understanding of how ITC interacts with reasoning across different models could provide important guidance on how to further advance the LLM frontier. This work conducts a comprehensive analysis of inference-time scaling methods for both reasoning and non-reasoning models on challenging reasoning tasks. Specifically, we focus our research on verifier-free inference time-scaling methods due to its generalizability without needing a reward model. We construct the Pareto frontier of quality and efficiency. We find that non-reasoning models, even with an extremely high inference budget, still fall substantially behind reasoning models. For reasoning models, majority voting proves to be a robust inference strategy, generally competitive or outperforming other more sophisticated ITC methods like best-of-N and sequential revisions, while the additional inference compute offers minimal improvements. We further perform in-depth analyses of the association of key response features (length and linguistic markers) with response quality, with which we can improve the existing ITC methods. We find that correct responses from reasoning models are typically shorter and have fewer hedging and thinking markers (but more discourse markers) than the incorrect responses."
arxiv,2311.03839,Aspects of human memory and Large Language Models,Romuald A. Janik,2023-11-07T09:39:12+00:00,cs.CL,http://arxiv.org/pdf/2311.03839v3,like,"Large Language Models (LLMs) are huge artificial neural networks which primarily serve to generate text, but also provide a very sophisticated probabilistic model of language use. Since generating a semantically consistent text requires a form of effective memory, we investigate the memory properties of LLMs and find surprising similarities with key characteristics of human memory. We argue that the human-like memory properties of the Large Language Model do not follow automatically from the LLM architecture but are rather learned from the statistics of the training textual data. These results strongly suggest that the biological features of human memory leave an imprint on the way that we structure our textual narratives."
arxiv,2504.13173,"It's All Connected: A Journey Through Test-Time Memorization, Attentional Bias, Retention, and Online Optimization",Ali Behrouz; Meisam Razaviyayn; Peilin Zhong; Vahab Mirrokni,2025-04-17T17:59:33+00:00,cs.LG,http://arxiv.org/pdf/2504.13173v1,like,"Designing efficient and effective architectural backbones has been in the core of research efforts to enhance the capability of foundation models. Inspired by the human cognitive phenomenon of attentional bias-the natural tendency to prioritize certain events or stimuli-we reconceptualize neural architectures, including Transformers, Titans, and modern linear recurrent neural networks as associative memory modules that learn a mapping of keys and values using an internal objective, referred to as attentional bias. Surprisingly, we observed that most existing sequence models leverage either (1) dot-product similarity, or (2) L2 regression objectives as their attentional bias. Going beyond these objectives, we present a set of alternative attentional bias configurations along with their effective approximations to stabilize their training procedure. We then reinterpret forgetting mechanisms in modern deep learning architectures as a form of retention regularization, providing a novel set of forget gates for sequence models. Building upon these insights, we present Miras, a general framework to design deep learning architectures based on four choices of: (i) associative memory architecture, (ii) attentional bias objective, (iii) retention gate, and (iv) memory learning algorithm. We present three novel sequence models-Moneta, Yaad, and Memora-that go beyond the power of existing linear RNNs while maintaining a fast parallelizable training process. Our experiments show different design choices in Miras yield models with varying strengths. For example, certain instances of Miras achieve exceptional performance in special tasks such as language modeling, commonsense reasoning, and recall intensive tasks, even outperforming Transformers and other modern linear recurrent models."
arxiv,2410.13413,Think Thrice Before You Act: Progressive Thought Refinement in Large Language Models,Chengyu Du; Jinyi Han; Yizhou Ying; Aili Chen; Qianyu He; Haokun Zhao; Sirui Xia; Haoran Guo; Jiaqing Liang; Zulong Chen; Liangyue Li; Yanghua Xiao,2024-10-17T10:23:24+00:00,cs.CL,http://arxiv.org/pdf/2410.13413v1,like,"Recent advancements in large language models (LLMs) have demonstrated that progressive refinement, rather than providing a single answer, results in more accurate and thoughtful outputs. However, existing methods often rely heavily on supervision signals to evaluate previous responses, making it difficult to assess output quality in more open-ended scenarios effectively. Additionally, these methods are typically designed for specific tasks, which limits their generalization to new domains. To address these limitations, we propose Progressive Thought Refinement (PTR), a framework that enables LLMs to refine their responses progressively. PTR operates in two phases: (1) Thought data construction stage: We propose a weak and strong model collaborative selection strategy to build a high-quality progressive refinement dataset to ensure logical consistency from thought to answers, and the answers are gradually refined in each round. (2) Thought-Mask Fine-Tuning Phase: We design a training structure to mask the ""thought"" and adjust loss weights to encourage LLMs to refine prior thought, teaching them to implicitly understand ""how to improve"" rather than ""what is correct."" Experimental results show that PTR significantly enhances LLM performance across ten diverse tasks (avg. from 49.6% to 53.5%) without task-specific fine-tuning. Notably, in more open-ended tasks, LLMs also demonstrate substantial improvements in the quality of responses beyond mere accuracy, suggesting that PTR truly teaches LLMs to self-improve over time."
arxiv,2504.16884,Do Large Language Models know who did what to whom?,Joseph M. Denning; Xiaohan Hannah Guo; Bryor Snefjella; Idan A. Blank,2025-04-23T17:00:45+00:00,cs.CL,http://arxiv.org/pdf/2504.16884v2,like,"Large Language Models (LLMs) are commonly criticized for not understanding language. However, many critiques focus on cognitive abilities that, in humans, are distinct from language processing. Here, we instead study a kind of understanding tightly linked to language: inferring who did what to whom (thematic roles) in a sentence. Does the central training objective of LLMs-word prediction-result in sentence representations that capture thematic roles? In two experiments, we characterized sentence representations in four LLMs. In contrast to human similarity judgments, in LLMs the overall representational similarity of sentence pairs reflected syntactic similarity but not whether their agent and patient assignments were identical vs. reversed. Furthermore, we found little evidence that thematic role information was available in any subset of hidden units. However, some attention heads robustly captured thematic roles, independently of syntax. Therefore, LLMs can extract thematic roles but, relative to humans, this information influences their representations more weakly."
arxiv,2504.16078,LLMs are Greedy Agents: Effects of RL Fine-tuning on Decision-Making Abilities,Thomas Schmied; Jörg Bornschein; Jordi Grau-Moya; Markus Wulfmeier; Razvan Pascanu,2025-04-22T17:57:14+00:00,cs.LG,http://arxiv.org/pdf/2504.16078v1,like,"The success of Large Language Models (LLMs) has sparked interest in various agentic applications. A key hypothesis is that LLMs, leveraging common sense and Chain-of-Thought (CoT) reasoning, can effectively explore and efficiently solve complex domains. However, LLM agents have been found to suffer from sub-optimal exploration and the knowing-doing gap, the inability to effectively act on knowledge present in the model. In this work, we systematically study why LLMs perform sub-optimally in decision-making scenarios. In particular, we closely examine three prevalent failure modes: greediness, frequency bias, and the knowing-doing gap. We propose mitigation of these shortcomings by fine-tuning via Reinforcement Learning (RL) on self-generated CoT rationales. Our experiments across multi-armed bandits, contextual bandits, and Tic-tac-toe, demonstrate that RL fine-tuning enhances the decision-making abilities of LLMs by increasing exploration and narrowing the knowing-doing gap. Finally, we study both classic exploration mechanisms, such as $\epsilon$-greedy, and LLM-specific approaches, such as self-correction and self-consistency, to enable more effective fine-tuning of LLMs for decision-making."
arxiv,2305.13048,RWKV: Reinventing RNNs for the Transformer Era,Bo Peng; Eric Alcaide; Quentin Anthony; Alon Albalak; Samuel Arcadinho; Stella Biderman; Huanqi Cao; Xin Cheng; Michael Chung; Matteo Grella; Kranthi Kiran GV; Xuzheng He; Haowen Hou; Jiaju Lin; Przemyslaw Kazienko; Jan Kocon; Jiaming Kong; Bartlomiej Koptyra; Hayden Lau; Krishna Sri Ipsit Mantri; Ferdinand Mom; Atsushi Saito; Guangyu Song; Xiangru Tang; Bolun Wang; Johan S. Wind; Stanislaw Wozniak; Ruichong Zhang; Zhenyuan Zhang; Qihang Zhao; Peng Zhou; Qinghua Zhou; Jian Zhu; Rui-Jie Zhu,2023-05-22T13:57:41+00:00,cs.CL,http://arxiv.org/pdf/2305.13048v2,like,"Transformers have revolutionized almost all natural language processing (NLP) tasks but suffer from memory and computational complexity that scales quadratically with sequence length. In contrast, recurrent neural networks (RNNs) exhibit linear scaling in memory and computational requirements but struggle to match the same performance as Transformers due to limitations in parallelization and scalability. We propose a novel model architecture, Receptance Weighted Key Value (RWKV), that combines the efficient parallelizable training of transformers with the efficient inference of RNNs.   Our approach leverages a linear attention mechanism and allows us to formulate the model as either a Transformer or an RNN, thus parallelizing computations during training and maintains constant computational and memory complexity during inference. We scale our models as large as 14 billion parameters, by far the largest dense RNN ever trained, and find RWKV performs on par with similarly sized Transformers, suggesting future work can leverage this architecture to create more efficient models. This work presents a significant step towards reconciling trade-offs between computational efficiency and model performance in sequence processing tasks."
arxiv,2504.16574,PIS: Linking Importance Sampling and Attention Mechanisms for Efficient Prompt Compression,Lizhe Chen; Binjia Zhou; Yuyao Ge; Jiayi Chen; Shiguang NI,2025-04-23T09:53:01+00:00,cs.CL,http://arxiv.org/pdf/2504.16574v1,dislike,"Large language models (LLMs) have achieved remarkable progress, demonstrating unprecedented capabilities across various natural language processing tasks. However, the high costs associated with such exceptional performance limit the widespread adoption of LLMs, highlighting the need for prompt compression. Existing prompt compression methods primarily rely on heuristic truncation or abstractive summarization techniques, which fundamentally overlook the intrinsic mechanisms of LLMs and lack a systematic evaluation of token importance for generation. In this work, we introduce Prompt Importance Sampling (PIS), a novel compression framework that dynamically compresses prompts by sampling important tokens based on the analysis of attention scores of hidden states. PIS employs a dual-level compression mechanism: 1) at the token level, we quantify saliency using LLM-native attention scores and implement adaptive compression through a lightweight 9-layer reinforcement learning (RL) network; 2) at the semantic level, we propose a Russian roulette sampling strategy for sentence-level importance sampling. Comprehensive evaluations across multiple domain benchmarks demonstrate that our method achieves state-of-the-art compression performance. Notably, our framework serendipitously enhances reasoning efficiency through optimized context structuring. This work advances prompt engineering by offering both theoretical grounding and practical efficiency in context management for LLMs."
arxiv,2504.1778,A quantitative theory and atomistic simulation study on the soft-sphere crystal-melt interfacial properties: II. Interfacial free energies,Ya-Shen Wang; Zun Liang; Brian B. Laird; Yang Yang,2025-04-02T14:40:02+00:00,cond-mat.mtrl-sci,http://arxiv.org/pdf/2504.01778v2,like,"This study proposes a new method for predicting the crystal-melt interfacial free energy ($\gamma$) using the Ginzburg-Landau (GL) model, enhanced by atomistic simulation data for more accurate density wave profiles. The analysis focuses on the soft-sphere system governed by an inverse power potential that stabilizes both BCC and FCC phases. Equilibrium molecular dynamics (MD) simulations are used to obtain density wave amplitude distributions, which serve as inputs for the GL model to predict $\gamma$ and its anisotropy. The predicted $\gamma$ values exhibit strong agreement with prior benchmark simulation experimental studies, particularly for FCC crystal-melt interfaces (CMIs). The GL models for the CMI $\gamma$ are proved to be both computationally efficient and reasonably valid, offering quantitative predictions of $\gamma$ while providing insights into the factors controlling its magnitude and anisotropy. Key improvement is suggested for the variational procedure used in the two-mode CMI free energy functionals, and potential upgrades to the GL model are also proposed to further enhance predictive accuracy."
arxiv,2504.15895,Dynamic Early Exit in Reasoning Models,Chenxu Yang; Qingyi Si; Yongjie Duan; Zheliang Zhu; Chenyu Zhu; Zheng Lin; Li Cao; Weiping Wang,2025-04-22T13:36:53+00:00,cs.CL,http://arxiv.org/pdf/2504.15895v1,like,"Recent advances in large reasoning language models (LRLMs) rely on test-time scaling, which extends long chain-of-thought (CoT) generation to solve complex tasks. However, overthinking in long CoT not only slows down the efficiency of problem solving, but also risks accuracy loss due to the extremely detailed or redundant reasoning steps. We propose a simple yet effective method that allows LLMs to self-truncate CoT sequences by early exit during generation. Instead of relying on fixed heuristics, the proposed method monitors model behavior at potential reasoning transition points (e.g.,""Wait"" tokens) and dynamically terminates the next reasoning chain's generation when the model exhibits high confidence in a trial answer. Our method requires no additional training and can be seamlessly integrated into existing o1-like reasoning LLMs. Experiments on multiple reasoning benchmarks MATH-500, AMC 2023, GPQA Diamond and AIME 2024 show that the proposed method is consistently effective on deepseek-series reasoning LLMs, reducing the length of CoT sequences by an average of 31% to 43% while improving accuracy by 1.7% to 5.7%."
arxiv,2410.05864,From Tokens to Words: On the Inner Lexicon of LLMs,Guy Kaplan; Matanel Oren; Yuval Reif; Roy Schwartz,2024-10-08T09:53:35+00:00,cs.CL,http://arxiv.org/pdf/2410.05864v4,like,"Natural language is composed of words, but modern large language models (LLMs) process sub-words as input. A natural question raised by this discrepancy is whether LLMs encode words internally, and if so how. We present evidence that LLMs engage in an intrinsic detokenization process, where sub-word sequences are combined into coherent whole-word representations at their last token. Our experiments show that this process primarily takes place within the early and middle layers of the model. We further demonstrate its robustness to arbitrary splits (e.g., ""cats"" to ""ca"" and ""ts""), typos, and importantly-to out-of-vocabulary words: when feeding the last token internal representations of such words to the model as input, it can ""understand"" them as the complete word despite never seeing such representations as input during training. Our findings suggest that LLMs maintain a latent vocabulary beyond the tokenizer's scope. These insights provide a practical, finetuning-free application for expanding the vocabulary of pre-trained models. By enabling the addition of new vocabulary words, we reduce input length and inference iterations, which reduces both space and model latency, with little to no loss in model accuracy."
arxiv,2402.15613,Towards Efficient Active Learning in NLP via Pretrained Representations,Artem Vysogorets; Achintya Gopal,2024-02-23T21:28:59+00:00,cs.LG,http://arxiv.org/pdf/2402.15613v1,like,"Fine-tuning Large Language Models (LLMs) is now a common approach for text classification in a wide range of applications. When labeled documents are scarce, active learning helps save annotation efforts but requires retraining of massive models on each acquisition iteration. We drastically expedite this process by using pretrained representations of LLMs within the active learning loop and, once the desired amount of labeled data is acquired, fine-tuning that or even a different pretrained LLM on this labeled data to achieve the best performance. As verified on common text classification benchmarks with pretrained BERT and RoBERTa as the backbone, our strategy yields similar performance to fine-tuning all the way through the active learning loop but is orders of magnitude less computationally expensive. The data acquired with our procedure generalizes across pretrained networks, allowing flexibility in choosing the final model or updating it as newer versions get released."
arxiv,2503.18216,Adaptive Rank Allocation: Speeding Up Modern Transformers with RaNA Adapters,Roberto Garcia; Jerry Liu; Daniel Sorvisto; Sabri Eyuboglu,2025-03-23T21:38:19+00:00,cs.LG,http://arxiv.org/pdf/2503.18216v1,like,"Large Language Models (LLMs) are computationally intensive, particularly during inference. Neuron-adaptive techniques, which selectively activate neurons in Multi-Layer Perceptron (MLP) layers, offer some speedups but suffer from limitations in modern Transformers. These include reliance on sparse activations, incompatibility with attention layers, and the use of costly neuron masking techniques. To address these issues, we propose the Adaptive Rank Allocation framework and introduce the Rank and Neuron Allocator (RaNA) adapter. RaNA adapters leverage rank adapters, which operate on linear layers by applying both low-rank matrix decompositions and adaptive masking to efficiently allocate compute without depending on activation sparsity. This enables RaNA to be generally applied to MLPs and linear components of attention modules, while eliminating the need for expensive maskers found in neuron-adaptive methods. Notably, when compared to neuron adapters, RaNA improves perplexity by up to 7 points and increases accuracy by up to 8 percentage-points when reducing FLOPs by $\sim$44% in state-of-the-art Transformer architectures. These results position RaNA as a robust solution for improving inference efficiency in modern Transformer architectures."
arxiv,2504.15466,Learning Adaptive Parallel Reasoning with Language Models,Jiayi Pan; Xiuyu Li; Long Lian; Charlie Snell; Yifei Zhou; Adam Yala; Trevor Darrell; Kurt Keutzer; Alane Suhr,2025-04-21T22:29:02+00:00,cs.AI,http://arxiv.org/pdf/2504.15466v1,like,"Scaling inference-time computation has substantially improved the reasoning capabilities of language models. However, existing methods have significant limitations: serialized chain-of-thought approaches generate overly long outputs, leading to increased latency and exhausted context windows, while parallel methods such as self-consistency suffer from insufficient coordination, resulting in redundant computations and limited performance gains. To address these shortcomings, we propose Adaptive Parallel Reasoning (APR), a novel reasoning framework that enables language models to orchestrate both serialized and parallel computations end-to-end. APR generalizes existing reasoning methods by enabling adaptive multi-threaded inference using spawn() and join() operations. A key innovation is our end-to-end reinforcement learning strategy, optimizing both parent and child inference threads to enhance task success rate without requiring predefined reasoning structures. Experiments on the Countdown reasoning task demonstrate significant benefits of APR: (1) higher performance within the same context window (83.4% vs. 60.0% at 4k context); (2) superior scalability with increased computation (80.1% vs. 66.6% at 20k total tokens); (3) improved accuracy at equivalent latency (75.2% vs. 57.3% at approximately 5,000ms). APR represents a step towards enabling language models to autonomously optimize their reasoning processes through adaptive allocation of computation."
