type,id,title,authors,date,primary_category,pdf_url,abstract,score,show
arxiv,2504.20944,Deep Learning Characterizes Depression and Suicidal Ideation from Eye Movements,Kleanthis Avramidis; Woojae Jeong; Aditya Kommineni; Sudarsana R. Kadiri; Marcus Ma; Colin McDaniel; Myzelle Hughes; Thomas McGee; Elsi Kaiser; Dani Byrd; Assal Habibi; B. Rael Cahn; Idan A. Blank; Kristina Lerman; Takfarinas Medani; Richard M. Leahy; Shrikanth Narayanan,2025-04-29T17:11:13+00:00,cs.LG,http://arxiv.org/pdf/2504.20944v1,"Identifying physiological and behavioral markers for mental health conditions is a longstanding challenge in psychiatry. Depression and suicidal ideation, in particular, lack objective biomarkers, with screening and diagnosis primarily relying on self-reports and clinical interviews. Here, we investigate eye tracking as a potential marker modality for screening purposes. Eye movements are directly modulated by neuronal networks and have been associated with attentional and mood-related patterns; however, their predictive value for depression and suicidality remains unclear. We recorded eye-tracking sequences from 126 young adults as they read and responded to affective sentences, and subsequently developed a deep learning framework to predict their clinical status. The proposed model included separate branches for trials of positive and negative sentiment, and used 2D time-series representations to account for both intra-trial and inter-trial variations. We were able to identify depression and suicidal ideation with an area under the receiver operating curve (AUC) of 0.793 (95% CI: 0.765-0.819) against healthy controls, and suicidality specifically with 0.826 AUC (95% CI: 0.797-0.852). The model also exhibited moderate, yet significant, accuracy in differentiating depressed from suicidal participants, with 0.609 AUC (95% CI 0.571-0.646). Discriminative patterns emerge more strongly when assessing the data relative to response generation than relative to the onset time of the final word of the sentences. The most pronounced effects were observed for negative-sentiment sentences, that are congruent to depressed and suicidal participants. Our findings highlight eye tracking as an objective tool for mental health assessment and underscore the modulatory impact of emotional stimuli on cognitive processes affecting oculomotor control.",0.1513274994871423,0
arxiv,2504.20942,Scenario-based Compositional Verification of Autonomous Systems with Neural Perception,Christopher Watson; Rajeev Alur; Divya Gopinath; Ravi Mangal; Corina S. Pasareanu,2025-04-29T17:06:22+00:00,cs.LG,http://arxiv.org/pdf/2504.20942v1,"Recent advances in deep learning have enabled the development of autonomous systems that use deep neural networks for perception. Formal verification of these systems is challenging due to the size and complexity of the perception DNNs as well as hard-to-quantify, changing environment conditions. To address these challenges, we propose a probabilistic verification framework for autonomous systems based on the following key concepts: (1) Scenario-based Modeling: We decompose the task (e.g., car navigation) into a composition of scenarios, each representing a different environment condition. (2) Probabilistic Abstractions: For each scenario, we build a compact abstraction of perception based on the DNN's performance on an offline dataset that represents the scenario's environment condition. (3) Symbolic Reasoning and Acceleration: The abstractions enable efficient compositional verification of the autonomous system via symbolic reasoning and a novel acceleration proof rule that bounds the error probability of the system under arbitrary variations of environment conditions. We illustrate our approach on two case studies: an experimental autonomous system that guides airplanes on taxiways using high-dimensional perception DNNs and a simulation model of an F1Tenth autonomous car using LiDAR observations.",0.14330792967576977,0
arxiv,2504.20940,Energy-Based Coarse-Graining in Molecular Dynamics: A Flow-Based Framework Without Data,Maximilian Stupp; P. S. Koutsourelakis,2025-04-29T17:05:27+00:00,physics.chem-ph,http://arxiv.org/pdf/2504.20940v1,"Coarse-grained (CG) models offer an effective route to reducing the complexity of molecular simulations, yet conventional approaches depend heavily on long all-atom molecular dynamics (MD) trajectories to adequately sample configurational space. This data-driven dependence limits their accuracy and generalizability, as unvisited configurations remain excluded from the resulting CG model. We introduce a data-free generative framework for coarse-graining that directly targets the all-atom Boltzmann distribution. Our model defines a structured latent space comprising slow collective variables, which are statistically associated with multimodal marginal densities capturing metastable states, and fast variables, which represent the remaining degrees of freedom with simple, unimodal conditional distributions. A potentially learnable, bijective map from the full latent space to the all-atom configuration space enables automatic and accurate reconstruction of molecular structures. The model is trained using an energy-based objective that minimizes the reverse Kullback-Leibler divergence, relying solely on the interatomic potential rather than sampled trajectories. A tempering scheme is used to stabilize training and promote exploration of diverse configurations. Once trained, the model can generate unbiased, one-shot equilibrium all-atom samples. We validate the method on two synthetic systems-a double-well potential and a Gaussian mixture-as well as on the benchmark alanine dipeptide. The model captures all relevant modes of the Boltzmann distribution, accurately reconstructs atomic configurations, and learns physically meaningful coarse-grained representations, all without any simulation data.",0.1635175198382221,1
arxiv,2504.20938,Towards Understanding the Nature of Attention with Low-Rank Sparse Decomposition,Zhengfu He; Junxuan Wang; Rui Lin; Xuyang Ge; Wentao Shu; Qiong Tang; Junping Zhang; Xipeng Qiu,2025-04-29T17:03:03+00:00,cs.LG,http://arxiv.org/pdf/2504.20938v1,"We propose Low-Rank Sparse Attention (Lorsa), a sparse replacement model of Transformer attention layers to disentangle original Multi Head Self Attention (MHSA) into individually comprehensible components. Lorsa is designed to address the challenge of attention superposition to understand attention-mediated interaction between features in different token positions. We show that Lorsa heads find cleaner and finer-grained versions of previously discovered MHSA behaviors like induction heads, successor heads and attention sink behavior (i.e., heavily attending to the first token). Lorsa and Sparse Autoencoder (SAE) are both sparse dictionary learning methods applied to different Transformer components, and lead to consistent findings in many ways. For instance, we discover a comprehensive family of arithmetic-specific Lorsa heads, each corresponding to an atomic operation in Llama-3.1-8B. Automated interpretability analysis indicates that Lorsa achieves parity with SAE in interpretability while Lorsa exhibits superior circuit discovery properties, especially for features computed collectively by multiple MHSA heads. We also conduct extensive experiments on architectural design ablation, Lorsa scaling law and error analysis.",0.18080328126203501,1
arxiv,2504.20932,Improvements of Dark Experience Replay and Reservoir Sampling towards Better Balance between Consolidation and Plasticity,Taisuke Kobayashi,2025-04-29T16:50:05+00:00,cs.LG,http://arxiv.org/pdf/2504.20932v1,"Continual learning is the one of the most essential abilities for autonomous agents, which can incrementally learn daily-life skills. For this ultimate goal, a simple but powerful method, dark experience replay (DER), has been proposed recently. DER mitigates catastrophic forgetting, in which the skills acquired in the past are unintentionally forgotten, by stochastically storing the streaming data in a reservoir sampling (RS) buffer and by relearning them or retaining the past outputs for them. However, since DER considers multiple objectives, it will not function properly without appropriate weighting of them. In addition, the ability to retain past outputs inhibits learning if the past outputs are incorrect due to distribution shift or other effects. This is due to a tradeoff between memory consolidation and plasticity. The tradeoff is hidden even in the RS buffer, which gradually stops storing new data for new skills in it as data is continuously passed to it. To alleviate the tradeoff and achieve better balance, this paper proposes improvement strategies to each of DER and RS. Specifically, DER is improved with automatic adaptation of weights, block of replaying erroneous data, and correction of past outputs. RS is also improved with generalization of acceptance probability, stratification of plural buffers, and intentional omission of unnecessary data. These improvements are verified through multiple benchmarks including regression, classification, and reinforcement learning problems. As a result, the proposed methods achieve steady improvements in learning performance by balancing the memory consolidation and plasticity.",0.16083798168961544,1
arxiv,2504.20927,Exploiting inter-agent coupling information for efficient reinforcement learning of cooperative LQR,Shahbaz P Qadri Syed; He Bai,2025-04-29T16:42:13+00:00,eess.SY,http://arxiv.org/pdf/2504.20927v1,"Developing scalable and efficient reinforcement learning algorithms for cooperative multi-agent control has received significant attention over the past years. Existing literature has proposed inexact decompositions of local Q-functions based on empirical information structures between the agents. In this paper, we exploit inter-agent coupling information and propose a systematic approach to exactly decompose the local Q-function of each agent. We develop an approximate least square policy iteration algorithm based on the proposed decomposition and identify two architectures to learn the local Q-function for each agent. We establish that the worst-case sample complexity of the decomposition is equal to the centralized case and derive necessary and sufficient graphical conditions on the inter-agent couplings to achieve better sample efficiency. We demonstrate the improved sample efficiency and computational efficiency on numerical examples.",0.15820405875471089,0
arxiv,2504.20922,DYNAMAX: Dynamic computing for Transformers and Mamba based architectures,Miguel Nogales; Matteo Gambella; Manuel Roveri,2025-04-29T16:38:15+00:00,cs.CL,http://arxiv.org/pdf/2504.20922v1,"Early exits (EEs) offer a promising approach to reducing computational costs and latency by dynamically terminating inference once a satisfactory prediction confidence on a data sample is achieved. Although many works integrate EEs into encoder-only Transformers, their application to decoder-only architectures and, more importantly, Mamba models, a novel family of state-space architectures in the LLM realm, remains insufficiently explored. This work introduces DYNAMAX, the first framework to exploit the unique properties of Mamba architectures for early exit mechanisms. We not only integrate EEs into Mamba but also repurpose Mamba as an efficient EE classifier for both Mamba-based and transformer-based LLMs, showcasing its versatility. Our experiments employ the Mistral 7B transformer compared to the Codestral 7B Mamba model, using data sets such as TruthfulQA, CoQA, and TriviaQA to evaluate computational savings, accuracy, and consistency. The results highlight the adaptability of Mamba as a powerful EE classifier and its efficiency in balancing computational cost and performance quality across NLP tasks. By leveraging Mamba's inherent design for dynamic processing, we open pathways for scalable and efficient inference in embedded applications and resource-constrained environments. This study underscores the transformative potential of Mamba in redefining dynamic computing paradigms for LLMs.",0.17328686127710027,0
arxiv,2504.20915,Statistical and Predictive Analysis to Identify Risk Factors and Effects of Post COVID-19 Syndrome,Milad Leyli-abadi; Jean-Patrick Brunet; Axel Tahmasebimoradi,2025-04-29T16:34:06+00:00,cs.LG,http://arxiv.org/pdf/2504.20915v1,"Based on recent studies, some COVID-19 symptoms can persist for months after infection, leading to what is termed long COVID. Factors such as vaccination timing, patient characteristics, and symptoms during the acute phase of infection may contribute to the prolonged effects and intensity of long COVID. Each patient, based on their unique combination of factors, develops a specific risk or intensity of long COVID. In this work, we aim to achieve two objectives: (1) conduct a statistical analysis to identify relationships between various factors and long COVID, and (2) perform predictive analysis of long COVID intensity using these factors. We benchmark and interpret various data-driven approaches, including linear models, random forests, gradient boosting, and neural networks, using data from the Lifelines COVID-19 cohort. Our results show that Neural Networks (NN) achieve the best performance in terms of MAPE, with predictions averaging 19\% error. Additionally, interpretability analysis reveals key factors such as loss of smell, headache, muscle pain, and vaccination timing as significant predictors, while chronic disease and gender are critical risk factors. These insights provide valuable guidance for understanding long COVID and developing targeted interventions.",0.16105943491117392,0
arxiv,2504.20908,MOSIC: Model-Agnostic Optimal Subgroup Identification with Multi-Constraint for Improved Reliability,Wenxin Chen; Weishen Pan; Kyra Gan; Fei Wang,2025-04-29T16:25:23+00:00,cs.LG,http://arxiv.org/pdf/2504.20908v1,"Identifying subgroups that benefit from specific treatments using observational data is a critical challenge in personalized medicine. Most existing approaches solely focus on identifying a subgroup with an improved treatment effect. However, practical considerations, such as ensuring a minimum subgroup size for representativeness or achieving sufficient confounder balance for reliability, are also important for making findings clinically meaningful and actionable. While some studies address these constraints individually, none offer a unified approach to handle them simultaneously. To bridge this gap, we propose a model-agnostic framework for optimal subgroup identification under multiple constraints. We reformulate this combinatorial problem as an unconstrained min-max optimization problem with novel modifications and solve it by a gradient descent ascent algorithm. We further prove its convergence to a feasible and locally optimal solution. Our method is stable and highly flexible, supporting various models and techniques for estimating and optimizing treatment effectiveness with observational data. Extensive experiments on both synthetic and real-world datasets demonstrate its effectiveness in identifying subgroups that satisfy multiple constraints, achieving higher treatment effects and better confounder balancing results across different group sizes.",0.1481713665020216,1
arxiv,2504.20906,GiBy: A Giant-Step Baby-Step Classifier For Anomaly Detection In Industrial Control Systems,Sarad Venugopalan; Sridhar Adepu,2025-04-29T16:24:11+00:00,cs.CR,http://arxiv.org/pdf/2504.20906v1,"The continuous monitoring of the interactions between cyber-physical components of any industrial control system (ICS) is required to secure automation of the system controls, and to guarantee plant processes are fail-safe and remain in an acceptably safe state. Safety is achieved by managing actuation (where electric signals are used to trigger physical movement), dependent on corresponding sensor readings; used as ground truth in decision making. Timely detection of anomalies (attacks, faults and unascertained states) in ICSs is crucial for the safe running of a plant, the safety of its personnel, and for the safe provision of any services provided. We propose an anomaly detection method that involves accurate linearization of the non-linear forms arising from sensor-actuator(s) relationships, primarily because solving linear models is easier and well understood. Further, the time complexity of the anomaly detection scenario/problem at hand is lowered using dimensionality reduction of the actuator(s) in relationship with a sensor. We accomplish this by using a well-known water treatment testbed as a use case. Our experiments show millisecond time response to detect anomalies and provide explainability; that are not simultaneously achieved by other state of the art AI/ML models with eXplainable AI (XAI) used for the same purpose. Further, we pin-point the sensor(s) and its actuation state for which anomaly was detected.",0.14423201952062994,0
arxiv,2504.20904,Dual Explanations via Subgraph Matching for Malware Detection,Hossein Shokouhinejad; Roozbeh Razavi-Far; Griffin Higgins; Ali A. Ghorbani,2025-04-29T16:20:28+00:00,cs.CR,http://arxiv.org/pdf/2504.20904v1,"Interpretable malware detection is crucial for understanding harmful behaviors and building trust in automated security systems. Traditional explainable methods for Graph Neural Networks (GNNs) often highlight important regions within a graph but fail to associate them with known benign or malicious behavioral patterns. This limitation reduces their utility in security contexts, where alignment with verified prototypes is essential. In this work, we introduce a novel dual prototype-driven explainable framework that interprets GNN-based malware detection decisions. This dual explainable framework integrates a base explainer (a state-of-the-art explainer) with a novel second-level explainer which is designed by subgraph matching technique, called SubMatch explainer. The proposed explainer assigns interpretable scores to nodes based on their association with matched subgraphs, offering a fine-grained distinction between benign and malicious regions. This prototype-guided scoring mechanism enables more interpretable, behavior-aligned explanations. Experimental results demonstrate that our method preserves high detection performance while significantly improving interpretability in malware analysis.",0.14547970669590732,0
arxiv,2504.20902,Classifier-to-Bias: Toward Unsupervised Automatic Bias Detection for Visual Classifiers,Quentin Guimard; Moreno D'Incà; Massimiliano Mancini; Elisa Ricci,2025-04-29T16:19:38+00:00,cs.CV,http://arxiv.org/pdf/2504.20902v1,"A person downloading a pre-trained model from the web should be aware of its biases. Existing approaches for bias identification rely on datasets containing labels for the task of interest, something that a non-expert may not have access to, or may not have the necessary resources to collect: this greatly limits the number of tasks where model biases can be identified. In this work, we present Classifier-to-Bias (C2B), the first bias discovery framework that works without access to any labeled data: it only relies on a textual description of the classification task to identify biases in the target classification model. This description is fed to a large language model to generate bias proposals and corresponding captions depicting biases together with task-specific target labels. A retrieval model collects images for those captions, which are then used to assess the accuracy of the model w.r.t. the given biases. C2B is training-free, does not require any annotations, has no constraints on the list of biases, and can be applied to any pre-trained model on any classification task. Experiments on two publicly available datasets show that C2B discovers biases beyond those of the original datasets and outperforms a recent state-of-the-art bias detection baseline that relies on task-specific annotations, being a promising first step toward addressing task-agnostic unsupervised bias detection.",0.1574819216904232,0
arxiv,2504.20900,Evaluating Generative Models for Tabular Data: Novel Metrics and Benchmarking,Dayananda Herurkar; Ahmad Ali; Andreas Dengel,2025-04-29T16:16:51+00:00,cs.LG,http://arxiv.org/pdf/2504.20900v1,"Generative models have revolutionized multiple domains, yet their application to tabular data remains underexplored. Evaluating generative models for tabular data presents unique challenges due to structural complexity, large-scale variability, and mixed data types, making it difficult to intuitively capture intricate patterns. Existing evaluation metrics offer only partial insights, lacking a comprehensive measure of generative performance. To address this limitation, we propose three novel evaluation metrics: FAED, FPCAD, and RFIS. Our extensive experimental analysis, conducted on three standard network intrusion detection datasets, compares these metrics with established evaluation methods such as Fidelity, Utility, TSTR, and TRTS. Our results demonstrate that FAED effectively captures generative modeling issues overlooked by existing metrics. While FPCAD exhibits promising performance, further refinements are necessary to enhance its reliability. Our proposed framework provides a robust and practical approach for assessing generative models in tabular data applications.",0.1478246902988747,1
arxiv,2504.20894,Does Feedback Help in Bandits with Arm Erasures?,Merve Karakas; Osama Hanna; Lin F. Yang; Christina Fragouli,2025-04-29T16:10:05+00:00,cs.LG,http://arxiv.org/pdf/2504.20894v1,"We study a distributed multi-armed bandit (MAB) problem over arm erasure channels, motivated by the increasing adoption of MAB algorithms over communication-constrained networks. In this setup, the learner communicates the chosen arm to play to an agent over an erasure channel with probability $\epsilon \in [0,1)$; if an erasure occurs, the agent continues pulling the last successfully received arm; the learner always observes the reward of the arm pulled. In past work, we considered the case where the agent cannot convey feedback to the learner, and thus the learner does not know whether the arm played is the requested or the last successfully received one. In this paper, we instead consider the case where the agent can send feedback to the learner on whether the arm request was received, and thus the learner exactly knows which arm was played. Surprisingly, we prove that erasure feedback does not improve the worst-case regret upper bound order over the previously studied no-feedback setting. In particular, we prove a regret lower bound of $\Omega(\sqrt{KT} + K / (1 - \epsilon))$, where $K$ is the number of arms and $T$ the time horizon, that matches no-feedback upper bounds up to logarithmic factors. We note however that the availability of feedback enables simpler algorithm designs that may achieve better constants (albeit not better order) regret bounds; we design one such algorithm and evaluate its performance numerically.",0.15463194990073306,1
arxiv,2504.20887,Return Capping: Sample-Efficient CVaR Policy Gradient Optimisation,Harry Mead; Clarissa Costen; Bruno Lacerda; Nick Hawes,2025-04-29T16:04:16+00:00,cs.LG,http://arxiv.org/pdf/2504.20887v1,"When optimising for conditional value at risk (CVaR) using policy gradients (PG), current methods rely on discarding a large proportion of trajectories, resulting in poor sample efficiency. We propose a reformulation of the CVaR optimisation problem by capping the total return of trajectories used in training, rather than simply discarding them, and show that this is equivalent to the original problem if the cap is set appropriately. We show, with empirical results in an number of environments, that this reformulation of the problem results in consistently improved performance compared to baselines.",0.161659466127219,0
arxiv,2504.20883,Guessing Efficiently for Constrained Subspace Approximation,Aditya Bhaskara; Sepideh Mahabadi; Madhusudhan Reddy Pittu; Ali Vakilian; David P. Woodruff,2025-04-29T15:56:48+00:00,cs.DS,http://arxiv.org/pdf/2504.20883v1,"In this paper we study constrained subspace approximation problem. Given a set of $n$ points $\{a_1,\ldots,a_n\}$ in $\mathbb{R}^d$, the goal of the {\em subspace approximation} problem is to find a $k$ dimensional subspace that best approximates the input points. More precisely, for a given $p\geq 1$, we aim to minimize the $p$th power of the $\ell_p$ norm of the error vector $(\|a_1-\bm{P}a_1\|,\ldots,\|a_n-\bm{P}a_n\|)$, where $\bm{P}$ denotes the projection matrix onto the subspace and the norms are Euclidean. In \emph{constrained} subspace approximation (CSA), we additionally have constraints on the projection matrix $\bm{P}$. In its most general form, we require $\bm{P}$ to belong to a given subset $\mathcal{S}$ that is described explicitly or implicitly.   We introduce a general framework for constrained subspace approximation. Our approach, that we term coreset-guess-solve, yields either $(1+\varepsilon)$-multiplicative or $\varepsilon$-additive approximations for a variety of constraints. We show that it provides new algorithms for partition-constrained subspace approximation with applications to {\it fair} subspace approximation, $k$-means clustering, and projected non-negative matrix factorization, among others. Specifically, while we reconstruct the best known bounds for $k$-means clustering in Euclidean spaces, we improve the known results for the remainder of the problems.",0.16045376223461005,1
