type,id,title,authors,date,primary_category,pdf_url,abstract,score,show
arxiv,2504.20504,Quality-factor inspired deep neural network solver for solving inverse scattering problems,Yutong Du; Zicheng Liu; Miao Cao; Zupeng Liang; Yali Zong; Changyou Li,2025-04-29T07:45:48+00:00,eess.IV,http://arxiv.org/pdf/2504.20504v1,"Deep neural networks have been applied to address electromagnetic inverse scattering problems (ISPs) and shown superior imaging performances, which can be affected by the training dataset, the network architecture and the applied loss function. Here, the quality of data samples is cared and valued by the defined quality factor. Based on the quality factor, the composition of the training dataset is optimized. The network architecture is integrated with the residual connections and channel attention mechanism to improve feature extraction. A loss function that incorporates data-fitting error, physical-information constraints and the desired feature of the solution is designed and analyzed to suppress the background artifacts and improve the reconstruction accuracy. Various numerical analysis are performed to demonstrate the superiority of the proposed quality-factor inspired deep neural network (QuaDNN) solver and the imaging performance is finally verified by experimental imaging test.",0.15807530735534742,1
arxiv,2504.20500,UniDetox: Universal Detoxification of Large Language Models via Dataset Distillation,Huimin Lu; Masaru Isonuma; Junichiro Mori; Ichiro Sakata,2025-04-29T07:40:00+00:00,cs.CL,http://arxiv.org/pdf/2504.20500v1,"We present UniDetox, a universally applicable method designed to mitigate toxicity across various large language models (LLMs). Previous detoxification methods are typically model-specific, addressing only individual models or model families, and require careful hyperparameter tuning due to the trade-off between detoxification efficacy and language modeling performance. In contrast, UniDetox provides a detoxification technique that can be universally applied to a wide range of LLMs without the need for separate model-specific tuning. Specifically, we propose a novel and efficient dataset distillation technique for detoxification using contrastive decoding. This approach distills detoxifying representations in the form of synthetic text data, enabling universal detoxification of any LLM through fine-tuning with the distilled text. Our experiments demonstrate that the detoxifying text distilled from GPT-2 can effectively detoxify larger models, including OPT, Falcon, and LLaMA-2. Furthermore, UniDetox eliminates the need for separate hyperparameter tuning for each model, as a single hyperparameter configuration can be seamlessly applied across different models. Additionally, analysis of the detoxifying text reveals a reduction in politically biased content, providing insights into the attributes necessary for effective detoxification of LLMs.",0.1673541724064343,0
arxiv,2504.20482,Group Relative Knowledge Distillation: Learning from Teacher's Relational Inductive Bias,Chao Li; Changhua Zhou; Jia Chen,2025-04-29T07:23:22+00:00,cs.LG,http://arxiv.org/pdf/2504.20482v1,"Knowledge distillation typically transfers knowledge from a teacher model to a student model by minimizing differences between their output distributions. However, existing distillation approaches largely focus on mimicking absolute probabilities and neglect the valuable relational inductive biases embedded in the teacher's relative predictions, leading to exposure bias. In this paper, we propose Group Relative Knowledge Distillation (GRKD), a novel framework that distills teacher knowledge by learning the relative ranking among classes, rather than directly fitting the absolute distribution. Specifically, we introduce a group relative loss that encourages the student model to preserve the pairwise preference orderings provided by the teacher's outputs. Extensive experiments on classification benchmarks demonstrate that GRKD achieves superior generalization compared to existing methods, especially in tasks requiring fine-grained class differentiation. Our method provides a new perspective on exploiting teacher knowledge, focusing on relational structure rather than absolute likelihood.",0.16516986796221406,0
arxiv,2504.20479,Full-field surrogate modeling of cardiac function encoding geometric variability,Elena Martinez; Beatrice Moscoloni; Matteo Salvador; Fanwei Kong; Mathias Peirlinck; Alison Lesley Marsden,2025-04-29T07:22:06+00:00,eess.IV,http://arxiv.org/pdf/2504.20479v1,"Combining physics-based modeling with data-driven methods is critical to enabling the translation of computational methods to clinical use in cardiology. The use of rigorous differential equations combined with machine learning tools allows for model personalization with uncertainty quantification in time frames compatible with clinical practice. However, accurate and efficient surrogate models of cardiac function, built from physics-based numerical simulation, are still mostly geometry-specific and require retraining for different patients and pathological conditions. We propose a novel computational pipeline to embed cardiac anatomies into full-field surrogate models. We generate a dataset of electrophysiology simulations using a complex multi-scale mathematical model coupling partial and ordinary differential equations. We adopt Branched Latent Neural Maps (BLNMs) as an effective scientific machine learning method to encode activation maps extracted from physics-based numerical simulations into a neural network. Leveraging large deformation diffeomorphic metric mappings, we build a biventricular anatomical atlas and parametrize the anatomical variability of a small and challenging cohort of 13 pediatric patients affected by Tetralogy of Fallot. We propose a novel statistical shape modeling based z-score sampling approach to generate a new synthetic cohort of 52 biventricular geometries that are compatible with the original geometrical variability. This synthetic cohort acts as the training set for BLNMs. Our surrogate model demonstrates robustness and great generalization across the complex original patient cohort, achieving an average adimensional mean squared error of 0.0034. The Python implementation of our BLNM model is publicly available under MIT License at https://github.com/StanfordCBCL/BLNM.",0.14894595195180402,0
arxiv,2504.20471,The Estimation of Continual Causal Effect for Dataset Shifting Streams,Baining Chen; Yiming Zhang; Yuqiao Han; Ruyue Zhang; Ruihuan Du; Zhishuo Zhou; Zhengdan Zhu; Xun Liu; Jiecheng Guo,2025-04-29T07:13:28+00:00,cs.LG,http://arxiv.org/pdf/2504.20471v1,"Causal effect estimation has been widely used in marketing optimization. The framework of an uplift model followed by a constrained optimization algorithm is popular in practice. To enhance performance in the online environment, the framework needs to be improved to address the complexities caused by temporal dataset shift. This paper focuses on capturing the dataset shift from user behavior and domain distribution changing over time. We propose an Incremental Causal Effect with Proxy Knowledge Distillation (ICE-PKD) framework to tackle this challenge. The ICE-PKD framework includes two components: (i) a multi-treatment uplift network that eliminates confounding bias using counterfactual regression; (ii) an incremental training strategy that adapts to the temporal dataset shift by updating with the latest data and protects generalization via replay-based knowledge distillation. We also revisit the uplift modeling metrics and introduce a novel metric for more precise online evaluation in multiple treatment scenarios. Extensive experiments on both simulated and online datasets show that the proposed framework achieves better performance. The ICE-PKD framework has been deployed in the marketing system of Huaxiaozhu, a ride-hailing platform in China.",0.1563207071852473,0
arxiv,2504.20456,Reviving Any-Subset Autoregressive Models with Principled Parallel Sampling and Speculative Decoding,Gabe Guo; Stefano Ermon,2025-04-29T06:33:13+00:00,cs.LG,http://arxiv.org/pdf/2504.20456v1,"In arbitrary-order language models, it is an open question how to sample tokens in parallel from the correct joint distribution. With discrete diffusion models, the more tokens they generate in parallel, the less their predicted distributions adhere to the originally learned data distribution, as they rely on a conditional independence assumption that only works with infinitesimally small timesteps. We find that a different class of models, any-subset autoregressive models (AS-ARMs), holds the solution. As implied by the name, AS-ARMs can generate tokens in any order, and in parallel. Moreover, AS-ARMs support parallelized joint probability density estimation, allowing them to correct their own parallel-generated token distributions, via our Any-Subset Speculative Decoding (ASSD) algorithm. ASSD provably enables generation of tokens from the correct joint distribution, with the number of neural network calls upper bounded by the number of tokens predicted. We empirically verify that ASSD speeds up language generation, without sacrificing quality. Furthermore, we provide a mathematically justified scheme for training AS-ARMs for generation, and show that AS-ARMs achieve state-of-the-art performance among sub-200M parameter models on infilling benchmark tasks, and nearly match the performance of models 50X larger on code generation. Our theoretical and empirical results indicate that the once-forgotten AS-ARMs are a promising direction of language modeling.",0.17001552497621164,1
arxiv,2504.20446,FT-MoE: Sustainable-learning Mixture of Experts Model for Fault-Tolerant Computing with Multiple Tasks,Wenjing Xiao; Wenhao Song; Miaojiang Chen; Ruikun Luo; Min Chen,2025-04-29T05:44:59+00:00,cs.LG,http://arxiv.org/pdf/2504.20446v1,"Intelligent fault-tolerant (FT) computing has recently demonstrated significant advantages of predicting and diagnosing faults in advance, enabling reliable service delivery. However, due to heterogeneity of fault knowledge and complex dependence relationships of time series log data, existing deep learning-based FT algorithms further improve detection performance relying on single neural network model with difficulty. To this end, we propose FT-MoE, a sustainable-learning mixture-of-experts model for fault-tolerant computing with multiple tasks, which enables different parameters learning distinct fault knowledge to achieve high-reliability for service system. Firstly, we use decoder-based transformer models to obtain fault prototype vectors of decoupling long-distance dependencies. Followed by, we present a dual mixture of experts networks for high-accurate prediction for both fault detection and classification tasks. Then, we design a two-stage optimization scheme of offline training and online tuning, which allows that in operation FT-MoE can also keep learning to adapt to dynamic service environments. Finally, to verify the effectiveness of FT-MoE, we conduct extensive experiments on the FT benchmark. Experimental results show that FT-MoE achieves superior performance compared to the state-of-the-art methods. Code will be available upon publication.",0.15494313266926787,1
arxiv,2504.20442,Multidimensional precipitation index prediction based on CNN-LSTM hybrid framework,Yuchen Wang; Pengfei Jia; Zhitao Shu; Keyan Liu; Abdul Rashid Mohamed Shariff,2025-04-29T05:32:43+00:00,cs.LG,http://arxiv.org/pdf/2504.20442v1,"With the intensification of global climate change, accurate prediction of weather indicators is of great significance in disaster prevention and mitigation, agricultural production, and transportation. Precipitation, as one of the key meteorological indicators, plays a crucial role in water resource management, agricultural production, and urban flood control. This study proposes a multidimensional precipitation index prediction model based on a CNN- LSTM hybrid framework, aiming to improve the accuracy of precipitation forecasts. The dataset is sourced from Pune, Maharashtra, India, covering monthly mean precipitation data from 1972 to 2002. This dataset includes nearly 31 years (1972-2002) of monthly average precipitation, reflecting the long-term fluctuations and seasonal variations of precipitation in the region. By analyzing these time series data, the CNN-LSTM model effectively captures local features and long-term dependencies. Experimental results show that the model achieves a root mean square error (RMSE) of 6.752, which demonstrates a significant advantage over traditional time series prediction methods in terms of prediction accuracy and generalization ability. Furthermore, this study provides new research ideas for precipitation prediction. However, the model requires high computational resources when dealing with large-scale datasets, and its predictive ability for multidimensional precipitation data still needs improvement. Future research could extend the model to support and predict multidimensional precipitation data, thereby promoting the development of more accurate and efficient meteorological prediction technologies.",0.15579905317941,0
arxiv,2504.20437,GaLore 2: Large-Scale LLM Pre-Training by Gradient Low-Rank Projection,DiJia Su; Andrew Gu; Jane Xu; Yuandong Tian; Jiawei Zhao,2025-04-29T05:27:02+00:00,cs.LG,http://arxiv.org/pdf/2504.20437v1,"Large language models (LLMs) have revolutionized natural language understanding and generation but face significant memory bottlenecks during training. GaLore, Gradient Low-Rank Projection, addresses this issue by leveraging the inherent low-rank structure of weight gradients, enabling substantial memory savings without sacrificing performance. Recent works further extend GaLore from various aspects, including low-bit quantization and higher-order tensor structures. However, there are several remaining challenges for GaLore, such as the computational overhead of SVD for subspace updates and the integration with state-of-the-art training parallelization strategies (e.g., FSDP). In this paper, we present GaLore 2, an efficient and scalable GaLore framework that addresses these challenges and incorporates recent advancements. In addition, we demonstrate the scalability of GaLore 2 by pre-training Llama 7B from scratch using up to 500 billion training tokens, highlighting its potential impact on real LLM pre-training scenarios.",0.190904225481437,0
arxiv,2504.20430,Learning Laplacian Positional Encodings for Heterophilous Graphs,Michael Ito; Jiong Zhu; Dexiong Chen; Danai Koutra; Jenna Wiens,2025-04-29T04:58:13+00:00,cs.LG,http://arxiv.org/pdf/2504.20430v1,"In this work, we theoretically demonstrate that current graph positional encodings (PEs) are not beneficial and could potentially hurt performance in tasks involving heterophilous graphs, where nodes that are close tend to have different labels. This limitation is critical as many real-world networks exhibit heterophily, and even highly homophilous graphs can contain local regions of strong heterophily. To address this limitation, we propose Learnable Laplacian Positional Encodings (LLPE), a new PE that leverages the full spectrum of the graph Laplacian, enabling them to capture graph structure on both homophilous and heterophilous graphs. Theoretically, we prove LLPE's ability to approximate a general class of graph distances and demonstrate its generalization properties. Empirically, our evaluation on 12 benchmarks demonstrates that LLPE improves accuracy across a variety of GNNs, including graph transformers, by up to 35% and 14% on synthetic and real-world graphs, respectively. Going forward, our work represents a significant step towards developing PEs that effectively capture complex structures in heterophilous graphs.",0.16184822798221032,0
arxiv,2504.20421,Understanding GNNs and Homophily in Dynamic Node Classification,Michael Ito; Danai Koutra; Jenna Wiens,2025-04-29T04:32:29+00:00,cs.LG,http://arxiv.org/pdf/2504.20421v1,"Homophily, as a measure, has been critical to increasing our understanding of graph neural networks (GNNs). However, to date this measure has only been analyzed in the context of static graphs. In our work, we explore homophily in dynamic settings. Focusing on graph convolutional networks (GCNs), we demonstrate theoretically that in dynamic settings, current GCN discriminative performance is characterized by the probability that a node's future label is the same as its neighbors' current labels. Based on this insight, we propose dynamic homophily, a new measure of homophily that applies in the dynamic setting. This new measure correlates with GNN discriminative performance and sheds light on how to potentially design more powerful GNNs for dynamic graphs. Leveraging a variety of dynamic node classification datasets, we demonstrate that popular GNNs are not robust to low dynamic homophily. Going forward, our work represents an important step towards understanding homophily and GNN performance in dynamic node classification.",0.1415659785730202,0
arxiv,2504.20411,ADiff4TPP: Asynchronous Diffusion Models for Temporal Point Processes,Amartya Mukherjee; Ruizhi Deng; He Zhao; Yuzhen Mao; Leonid Sigal; Frederick Tung,2025-04-29T04:17:39+00:00,cs.LG,http://arxiv.org/pdf/2504.20411v1,"This work introduces a novel approach to modeling temporal point processes using diffusion models with an asynchronous noise schedule. At each step of the diffusion process, the noise schedule injects noise of varying scales into different parts of the data. With a careful design of the noise schedules, earlier events are generated faster than later ones, thus providing stronger conditioning for forecasting the more distant future. We derive an objective to effectively train these models for a general family of noise schedules based on conditional flow matching. Our method models the joint distribution of the latent representations of events in a sequence and achieves state-of-the-art results in predicting both the next inter-event time and event type on benchmark datasets. Additionally, it flexibly accommodates varying lengths of observation and prediction windows in different forecasting settings by adjusting the starting and ending points of the generation process. Finally, our method shows superior performance in long-horizon prediction tasks, outperforming existing baseline methods.",0.16084037297257306,0
arxiv,2504.20408,FourierSpecNet: Neural Collision Operator Approximation Inspired by the Fourier Spectral Method for Solving the Boltzmann Equation,Jae Yong Lee; Gwang Jae Jung; Byung Chan Lim; Hyung Ju Hwang,2025-04-29T04:07:03+00:00,cs.LG,http://arxiv.org/pdf/2504.20408v1,"The Boltzmann equation, a fundamental model in kinetic theory, describes the evolution of particle distribution functions through a nonlinear, high-dimensional collision operator. However, its numerical solution remains computationally demanding, particularly for inelastic collisions and high-dimensional velocity domains. In this work, we propose the Fourier Neural Spectral Network (FourierSpecNet), a hybrid framework that integrates the Fourier spectral method with deep learning to approximate the collision operator in Fourier space efficiently. FourierSpecNet achieves resolution-invariant learning and supports zero-shot super-resolution, enabling accurate predictions at unseen resolutions without retraining. Beyond empirical validation, we establish a consistency result showing that the trained operator converges to the spectral solution as the discretization is refined. We evaluate our method on several benchmark cases, including Maxwellian and hard-sphere molecular models, as well as inelastic collision scenarios. The results demonstrate that FourierSpecNet offers competitive accuracy while significantly reducing computational cost compared to traditional spectral solvers. Our approach provides a robust and scalable alternative for solving the Boltzmann equation across both elastic and inelastic regimes.",0.1522597670011543,1
arxiv,2504.20405,SCOPE-MRI: Bankart Lesion Detection as a Case Study in Data Curation and Deep Learning for Challenging Diagnoses,Sahil Sethi; Sai Reddy; Mansi Sakarvadia; Jordan Serotte; Darlington Nwaudo; Nicholas Maassen; Lewis Shi,2025-04-29T04:02:44+00:00,eess.IV,http://arxiv.org/pdf/2504.20405v1,"While deep learning has shown strong performance in musculoskeletal imaging, existing work has largely focused on pathologies where diagnosis is not a clinical challenge, leaving more difficult problems underexplored, such as detecting Bankart lesions (anterior-inferior glenoid labral tears) on standard MRIs. Diagnosing these lesions is challenging due to their subtle imaging features, often leading to reliance on invasive MRI arthrograms (MRAs). This study introduces ScopeMRI, the first publicly available, expert-annotated dataset for shoulder pathologies, and presents a deep learning (DL) framework for detecting Bankart lesions on both standard MRIs and MRAs. ScopeMRI includes 586 shoulder MRIs (335 standard, 251 MRAs) from 558 patients who underwent arthroscopy. Ground truth labels were derived from intraoperative findings, the gold standard for diagnosis. Separate DL models for MRAs and standard MRIs were trained using a combination of CNNs and transformers. Predictions from sagittal, axial, and coronal views were ensembled to optimize performance. The models were evaluated on a 20% hold-out test set (117 MRIs: 46 MRAs, 71 standard MRIs). The models achieved an AUC of 0.91 and 0.93, sensitivity of 83% and 94%, and specificity of 91% and 86% for standard MRIs and MRAs, respectively. Notably, model performance on non-invasive standard MRIs matched or surpassed radiologists interpreting MRAs. External validation demonstrated initial generalizability across imaging protocols. This study demonstrates that DL models can achieve radiologist-level diagnostic performance on standard MRIs, reducing the need for invasive MRAs. By releasing ScopeMRI and a modular codebase for training and evaluating deep learning models on 3D medical imaging data, we aim to accelerate research in musculoskeletal imaging and support the development of new datasets for clinically challenging diagnostic tasks.",0.1502290866254837,1
arxiv,2504.20401,Nonlinear Computation with Linear Optics via Source-Position Encoding,N. Richardson; C. Bosch; R. P. Adams,2025-04-29T03:55:05+00:00,physics.optics,http://arxiv.org/pdf/2504.20401v1,"Optical computing systems provide an alternate hardware model which appears to be aligned with the demands of neural network workloads. However, the challenge of implementing energy efficient nonlinearities in optics -- a key requirement for realizing neural networks -- is a conspicuous missing link. In this work we introduce a novel method to achieve nonlinear computation in fully linear media. Our method can operate at low power and requires only the ability to drive the optical system at a data-dependent spatial position. Leveraging this positional encoding, we formulate a fully automated, topology-optimization-based hardware design framework for extremely specialized optical neural networks, drawing on modern advancements in optimization and machine learning. We evaluate our optical designs on machine learning classification tasks: demonstrating significant improvements over linear methods, and competitive performance when compared to standard artificial neural networks.",0.1599929842064357,1
arxiv,2504.20395,Partial Answer of How Transformers Learn Automata,Tiantian; Zhang,2025-04-29T03:35:40+00:00,cs.FL,http://arxiv.org/pdf/2504.20395v1,"We introduce a novel framework for simulating finite automata using representation-theoretic semidirect products and Fourier modules, achieving more efficient Transformer-based implementations.",0.1494765542008853,1
arxiv,2504.20390,Manifold Clustering with Schatten p-norm Maximization,Fangfang Li; Quanxue Gao,2025-04-29T03:23:06+00:00,cs.LG,http://arxiv.org/pdf/2504.20390v1,"Manifold clustering, with its exceptional ability to capture complex data structures, holds a pivotal position in cluster analysis. However, existing methods often focus only on finding the optimal combination between K-means and manifold learning, and overlooking the consistency between the data structure and labels. To address this issue, we deeply explore the relationship between K-means and manifold learning, and on this basis, fuse them to develop a new clustering framework. Specifically, the algorithm uses labels to guide the manifold structure and perform clustering on it, which ensures the consistency between the data structure and labels. Furthermore, in order to naturally maintain the class balance in the clustering process, we maximize the Schatten p-norm of labels, and provide a theoretical proof to support this. Additionally, our clustering framework is designed to be flexible and compatible with many types of distance functions, which facilitates efficient processing of nonlinear separable data. The experimental results of several databases confirm the superiority of our proposed model.",0.1578800389158657,1
