type,id,title,authors,date,primary_category,pdf_url,abstract,score,show
arxiv,2504.20643,Cooking Up Creativity: A Cognitively-Inspired Approach for Enhancing LLM Creativity through Structured Representations,Moran Mizrahi; Chen Shani; Gabriel Stanovsky; Dan Jurafsky; Dafna Shahaf,2025-04-29T11:13:06+00:00,cs.CL,http://arxiv.org/pdf/2504.20643v1,"Large Language Models (LLMs) excel at countless tasks, yet struggle with creativity. In this paper, we introduce a novel approach that couples LLMs with structured representations and cognitively inspired manipulations to generate more creative and diverse ideas. Our notion of creativity goes beyond superficial token-level variations; rather, we explicitly recombine structured representations of existing ideas, allowing our algorithm to effectively explore the more abstract landscape of ideas. We demonstrate our approach in the culinary domain with DishCOVER, a model that generates creative recipes. Experiments comparing our model's results to those of GPT-4o show greater diversity. Domain expert evaluations reveal that our outputs, which are mostly coherent and feasible culinary creations, significantly surpass GPT-4o in terms of novelty, thus outperforming it in creative generation. We hope our work inspires further research into structured creativity in AI.",0.17574656593521223,1
arxiv,2504.20634,On Stochastic Rounding with Few Random Bits,Andrew Fitzgibbon; Stephen Felix,2025-04-29T11:04:25+00:00,math.NA,http://arxiv.org/pdf/2504.20634v1,"Large-scale numerical computations make increasing use of low-precision (LP) floating point formats and mixed precision arithmetic, which can be enhanced by the technique of stochastic rounding (SR), that is, rounding an intermediate high-precision value up or down randomly as a function of the value's distance to the two rounding candidates. Stochastic rounding requires, in addition to the high-precision input value, a source of random bits. As the provision of high-quality random bits is an additional computational cost, it is of interest to require as few bits as possible while maintaining the desirable properties of SR in a given computation, or computational domain. This paper examines a number of possible implementations of few-bit stochastic rounding (FBSR), and shows how several natural implementations can introduce sometimes significant bias into the rounding process, which are not present in the case of infinite-bit, infinite-precision examinations of these implementations. The paper explores the impact of these biases in machine learning examples, and hence opens another class of configuration parameters of which practitioners should be aware when developing or adopting low-precision floating point. Code is available at http://github.com/graphcore-research/arith25-stochastic-rounding.",0.16518592463171128,0
arxiv,2504.20629,AlignDiT: Multimodal Aligned Diffusion Transformer for Synchronized Speech Generation,Jeongsoo Choi; Ji-Hoon Kim; Kim Sung-Bin; Tae-Hyun Oh; Joon Son Chung,2025-04-29T10:56:24+00:00,cs.CV,http://arxiv.org/pdf/2504.20629v1,"In this paper, we address the task of multimodal-to-speech generation, which aims to synthesize high-quality speech from multiple input modalities: text, video, and reference audio. This task has gained increasing attention due to its wide range of applications, such as film production, dubbing, and virtual avatars. Despite recent progress, existing methods still suffer from limitations in speech intelligibility, audio-video synchronization, speech naturalness, and voice similarity to the reference speaker. To address these challenges, we propose AlignDiT, a multimodal Aligned Diffusion Transformer that generates accurate, synchronized, and natural-sounding speech from aligned multimodal inputs. Built upon the in-context learning capability of the DiT architecture, AlignDiT explores three effective strategies to align multimodal representations. Furthermore, we introduce a novel multimodal classifier-free guidance mechanism that allows the model to adaptively balance information from each modality during speech synthesis. Extensive experiments demonstrate that AlignDiT significantly outperforms existing methods across multiple benchmarks in terms of quality, synchronization, and speaker similarity. Moreover, AlignDiT exhibits strong generalization capability across various multimodal tasks, such as video-to-speech synthesis and visual forced alignment, consistently achieving state-of-the-art performance. The demo page is available at https://mm.kaist.ac.kr/projects/AlignDiT .",0.15632532323311277,1
arxiv,2504.20628,Cognitive maps are generative programs,Marta Kryven; Cole Wyeth; Aidan Curtis; Kevin Ellis,2025-04-29T10:55:40+00:00,cs.AI,http://arxiv.org/pdf/2504.20628v1,"Making sense of the world and acting in it relies on building simplified mental representations that abstract away aspects of reality. This principle of cognitive mapping is universal to agents with limited resources. Living organisms, people, and algorithms all face the problem of forming functional representations of their world under various computing constraints. In this work, we explore the hypothesis that human resource-efficient planning may arise from representing the world as predictably structured. Building on the metaphor of concepts as programs, we propose that cognitive maps can take the form of generative programs that exploit predictability and redundancy, in contrast to directly encoding spatial layouts. We use a behavioral experiment to show that people who navigate in structured spaces rely on modular planning strategies that align with programmatic map representations. We describe a computational model that predicts human behavior in a variety of structured scenarios. This model infers a small distribution over possible programmatic cognitive maps conditioned on human prior knowledge of the world, and uses this distribution to generate resource-efficient plans. Our models leverages a Large Language Model as an embedding of human priors, implicitly learned through training on a vast corpus of human data. Our model demonstrates improved computational efficiency, requires drastically less memory, and outperforms unstructured planning algorithms with cognitive constraints at predicting human behavior, suggesting that human planning strategies rely on programmatic cognitive maps.",0.168949055036764,0
arxiv,2504.20625,DiffusionRIR: Room Impulse Response Interpolation using Diffusion Models,Sagi Della Torre; Mirco Pezzoli; Fabio Antonacci; Sharon Gannot,2025-04-29T10:52:07+00:00,cs.SD,http://arxiv.org/pdf/2504.20625v1,"Room Impulse Responses (RIRs) characterize acoustic environments and are crucial in multiple audio signal processing tasks. High-quality RIR estimates drive applications such as virtual microphones, sound source localization, augmented reality, and data augmentation. However, obtaining RIR measurements with high spatial resolution is resource-intensive, making it impractical for large spaces or when dense sampling is required. This research addresses the challenge of estimating RIRs at unmeasured locations within a room using Denoising Diffusion Probabilistic Models (DDPM). Our method leverages the analogy between RIR matrices and image inpainting, transforming RIR data into a format suitable for diffusion-based reconstruction.   Using simulated RIR data based on the image method, we demonstrate our approach's effectiveness on microphone arrays of different curvatures, from linear to semi-circular. Our method successfully reconstructs missing RIRs, even in large gaps between microphones. Under these conditions, it achieves accurate reconstruction, significantly outperforming baseline Spline Cubic Interpolation in terms of Normalized Mean Square Error and Cosine Distance between actual and interpolated RIRs.   This research highlights the potential of using generative models for effective RIR interpolation, paving the way for generating additional data from limited real-world measurements.",0.15959020439011634,1
arxiv,2504.20624,PaRT: Enhancing Proactive Social Chatbots with Personalized Real-Time Retrieval,Zihan Niu; Zheyong Xie; Shaosheng Cao; Chonggang Lu; Zheyu Ye; Tong Xu; Zuozhu Liu; Yan Gao; Jia Chen; Zhe Xu; Yi Wu; Yao Hu,2025-04-29T10:51:58+00:00,cs.AI,http://arxiv.org/pdf/2504.20624v1,"Social chatbots have become essential intelligent companions in daily scenarios ranging from emotional support to personal interaction. However, conventional chatbots with passive response mechanisms usually rely on users to initiate or sustain dialogues by bringing up new topics, resulting in diminished engagement and shortened dialogue duration. In this paper, we present PaRT, a novel framework enabling context-aware proactive dialogues for social chatbots through personalized real-time retrieval and generation. Specifically, PaRT first integrates user profiles and dialogue context into a large language model (LLM), which is initially prompted to refine user queries and recognize their underlying intents for the upcoming conversation. Guided by refined intents, the LLM generates personalized dialogue topics, which then serve as targeted queries to retrieve relevant passages from RedNote. Finally, we prompt LLMs with summarized passages to generate knowledge-grounded and engagement-optimized responses. Our approach has been running stably in a real-world production environment for more than 30 days, achieving a 21.77\% improvement in the average duration of dialogues.",0.1757818772678276,0
arxiv,2504.20612,The Hidden Risks of LLM-Generated Web Application Code: A Security-Centric Evaluation of Code Generation Capabilities in Large Language Models,Swaroop Dora; Deven Lunkad; Naziya Aslam; S. Venkatesan; Sandeep Kumar Shukla,2025-04-29T10:23:11+00:00,cs.CR,http://arxiv.org/pdf/2504.20612v1,"The rapid advancement of Large Language Models (LLMs) has enhanced software development processes, minimizing the time and effort required for coding and enhancing developer productivity. However, despite their potential benefits, code generated by LLMs has been shown to generate insecure code in controlled environments, raising critical concerns about their reliability and security in real-world applications. This paper uses predefined security parameters to evaluate the security compliance of LLM-generated code across multiple models, such as ChatGPT, DeepSeek, Claude, Gemini and Grok. The analysis reveals critical vulnerabilities in authentication mechanisms, session management, input validation and HTTP security headers. Although some models implement security measures to a limited extent, none fully align with industry best practices, highlighting the associated risks in automated software development. Our findings underscore that human expertise is crucial to ensure secure software deployment or review of LLM-generated code. Also, there is a need for robust security assessment frameworks to enhance the reliability of LLM-generated code in real-world applications.",0.1637497311000707,1
arxiv,2504.20610,Information Retrieval in the Age of Generative AI: The RGB Model,Michele Garetto; Alessandro Cornacchia; Franco Galante; Emilio Leonardi; Alessandro Nordio; Alberto Tarable,2025-04-29T10:21:40+00:00,cs.IR,http://arxiv.org/pdf/2504.20610v1,"The advent of Large Language Models (LLMs) and generative AI is fundamentally transforming information retrieval and processing on the Internet, bringing both great potential and significant concerns regarding content authenticity and reliability. This paper presents a novel quantitative approach to shed light on the complex information dynamics arising from the growing use of generative AI tools. Despite their significant impact on the digital ecosystem, these dynamics remain largely uncharted and poorly understood. We propose a stochastic model to characterize the generation, indexing, and dissemination of information in response to new topics. This scenario particularly challenges current LLMs, which often rely on real-time Retrieval-Augmented Generation (RAG) techniques to overcome their static knowledge limitations. Our findings suggest that the rapid pace of generative AI adoption, combined with increasing user reliance, can outpace human verification, escalating the risk of inaccurate information proliferation across digital resources. An in-depth analysis of Stack Exchange data confirms that high-quality answers inevitably require substantial time and human effort to emerge. This underscores the considerable risks associated with generating persuasive text in response to new questions and highlights the critical need for responsible development and deployment of future generative AI tools.",0.1676124759904538,0
arxiv,2504.20595,ReasonIR: Training Retrievers for Reasoning Tasks,Rulin Shao; Rui Qiao; Varsha Kishore; Niklas Muennighoff; Xi Victoria Lin; Daniela Rus; Bryan Kian Hsiang Low; Sewon Min; Wen-tau Yih; Pang Wei Koh; Luke Zettlemoyer,2025-04-29T09:49:28+00:00,cs.AI,http://arxiv.org/pdf/2504.20595v1,"We present ReasonIR-8B, the first retriever specifically trained for general reasoning tasks. Existing retrievers have shown limited gains on reasoning tasks, in part because existing training datasets focus on short factual queries tied to documents that straightforwardly answer them. We develop a synthetic data generation pipeline that, for each document, our pipeline creates a challenging and relevant query, along with a plausibly related but ultimately unhelpful hard negative. By training on a mixture of our synthetic data and existing public data, ReasonIR-8B achieves a new state-of-the-art of 29.9 nDCG@10 without reranker and 36.9 nDCG@10 with reranker on BRIGHT, a widely-used reasoning-intensive information retrieval (IR) benchmark. When applied to RAG tasks, ReasonIR-8B improves MMLU and GPQA performance by 6.4% and 22.6% respectively, relative to the closed-book baseline, outperforming other retrievers and search engines. In addition, ReasonIR-8B uses test-time compute more effectively: on BRIGHT, its performance consistently increases with longer and more information-rich rewritten queries; it continues to outperform other retrievers when combined with an LLM reranker. Our training recipe is general and can be easily extended to future LLMs; to this end, we open-source our code, data, and model.",0.1720304877346881,1
arxiv,2504.20571,Reinforcement Learning for Reasoning in Large Language Models with One Training Example,Yiping Wang; Qing Yang; Zhiyuan Zeng; Liliang Ren; Lucas Liu; Baolin Peng; Hao Cheng; Xuehai He; Kuan Wang; Jianfeng Gao; Weizhu Chen; Shuohang Wang; Simon Shaolei Du; Yelong Shen,2025-04-29T09:24:30+00:00,cs.LG,http://arxiv.org/pdf/2504.20571v1,"We show that reinforcement learning with verifiable reward using one training example (1-shot RLVR) is effective in incentivizing the math reasoning capabilities of large language models (LLMs). Applying RLVR to the base model Qwen2.5-Math-1.5B, we identify a single example that elevates model performance on MATH500 from 36.0% to 73.6%, and improves the average performance across six common mathematical reasoning benchmarks from 17.6% to 35.7%. This result matches the performance obtained using the 1.2k DeepScaleR subset (MATH500: 73.6%, average: 35.9%), which includes the aforementioned example. Similar substantial improvements are observed across various models (Qwen2.5-Math-7B, Llama3.2-3B-Instruct, DeepSeek-R1-Distill-Qwen-1.5B), RL algorithms (GRPO and PPO), and different math examples (many of which yield approximately 30% or greater improvement on MATH500 when employed as a single training example). In addition, we identify some interesting phenomena during 1-shot RLVR, including cross-domain generalization, increased frequency of self-reflection, and sustained test performance improvement even after the training accuracy has saturated, a phenomenon we term post-saturation generalization. Moreover, we verify that the effectiveness of 1-shot RLVR primarily arises from the policy gradient loss, distinguishing it from the ""grokking"" phenomenon. We also show the critical role of promoting exploration (e.g., by adding entropy loss with an appropriate coefficient) in 1-shot RLVR training. As a bonus, we observe that applying entropy loss alone, without any outcome reward, significantly enhances Qwen2.5-Math-1.5B's performance on MATH500 by 27.4%. These findings can inspire future work on RLVR data efficiency and encourage a re-examination of both recent progress and the underlying mechanisms in RLVR. Our code, model, and data are open source at https://github.com/ypwang61/One-Shot-RLVR",0.1773761203761056,0
arxiv,2504.20566,Inclusive Training Separation and Implicit Knowledge Interaction for Balanced Online Class-Incremental Learning,Shunjie Wen; Thomas Heinis; Dong-Wan Choi,2025-04-29T09:13:00+00:00,cs.LG,http://arxiv.org/pdf/2504.20566v1,"Online class-incremental learning (OCIL) focuses on gradually learning new classes (called plasticity) from a stream of data in a single-pass, while concurrently preserving knowledge of previously learned classes (called stability). The primary challenge in OCIL lies in maintaining a good balance between the knowledge of old and new classes within the continually updated model. Most existing methods rely on explicit knowledge interaction through experience replay, and often employ exclusive training separation to address bias problems. Nevertheless, it still remains a big challenge to achieve a well-balanced learner, as these methods often exhibit either reduced plasticity or limited stability due to difficulties in continually integrating knowledge in the OCIL setting. In this paper, we propose a novel replay-based method, called Balanced Online Incremental Learning (BOIL), which can achieve both high plasticity and stability, thus ensuring more balanced performance in OCIL. Our BOIL method proposes an inclusive training separation strategy using dual classifiers so that knowledge from both old and new classes can effectively be integrated into the model, while introducing implicit approaches for transferring knowledge across the two classifiers. Extensive experimental evaluations over three widely-used OCIL benchmark datasets demonstrate the superiority of BOIL, showing more balanced yet better performance compared to state-of-the-art replay-based OCIL methods.",0.15501905112173703,1
arxiv,2504.20560,Generate more than one child in your co-evolutionary semi-supervised learning GAN,Francisco Sedeño; Jamal Toutouh; Francisco Chicano,2025-04-29T09:04:22+00:00,cs.NE,http://arxiv.org/pdf/2504.20560v1,"Generative Adversarial Networks (GANs) are very useful methods to address semi-supervised learning (SSL) datasets, thanks to their ability to generate samples similar to real data. This approach, called SSL-GAN has attracted many researchers in the last decade. Evolutionary algorithms have been used to guide the evolution and training of SSL-GANs with great success. In particular, several co-evolutionary approaches have been applied where the two networks of a GAN (the generator and the discriminator) are evolved in separate populations. The co-evolutionary approaches published to date assume some spatial structure of the populations, based on the ideas of cellular evolutionary algorithms. They also create one single individual per generation and follow a generational replacement strategy in the evolution. In this paper, we re-consider those algorithmic design decisions and propose a new co-evolutionary approach, called Co-evolutionary Elitist SSL-GAN (CE-SSLGAN), with panmictic population, elitist replacement, and more than one individual in the offspring. We evaluate the performance of our proposed method using three standard benchmark datasets. The results show that creating more than one offspring per population and using elitism improves the results in comparison with a classical SSL-GAN.",0.15403513535112853,1
arxiv,2504.20520,PRISM: Projection-based Reward Integration for Scene-Aware Real-to-Sim-to-Real Transfer with Few Demonstrations,Haowen Sun; Han Wang; Chengzhong Ma; Shaolong Zhang; Jiawei Ye; Xingyu Chen; Xuguang Lan,2025-04-29T08:01:27+00:00,cs.RO,http://arxiv.org/pdf/2504.20520v1,"Learning from few demonstrations to develop policies robust to variations in robot initial positions and object poses is a problem of significant practical interest in robotics. Compared to imitation learning, which often struggles to generalize from limited samples, reinforcement learning (RL) can autonomously explore to obtain robust behaviors. Training RL agents through direct interaction with the real world is often impractical and unsafe, while building simulation environments requires extensive manual effort, such as designing scenes and crafting task-specific reward functions. To address these challenges, we propose an integrated real-to-sim-to-real pipeline that constructs simulation environments based on expert demonstrations by identifying scene objects from images and retrieving their corresponding 3D models from existing libraries. We introduce a projection-based reward model for RL policy training that is supervised by a vision-language model (VLM) using human-guided object projection relationships as prompts, with the policy further fine-tuned using expert demonstrations. In general, our work focuses on the construction of simulation environments and RL-based policy training, ultimately enabling the deployment of reliable robotic control policies in real-world scenarios.",0.153425990807042,0
arxiv,2504.20505,MuRAL: A Multi-Resident Ambient Sensor Dataset Annotated with Natural Language for Activities of Daily Living,Xi Chen; Julien Cumin; Fano Ramparany; Dominique Vaufreydaz,2025-04-29T07:46:14+00:00,cs.AI,http://arxiv.org/pdf/2504.20505v1,"Recent advances in Large Language Models (LLMs) have shown promising potential for human activity recognition (HAR) using ambient sensors, especially through natural language reasoning and zero-shot learning. However, existing datasets such as CASAS, ARAS, and MARBLE were not originally designed with LLMs in mind and therefore lack the contextual richness, complexity, and annotation granularity required to fully exploit LLM capabilities. In this paper, we introduce MuRAL, the first Multi-Resident Ambient sensor dataset with natural Language, comprising over 21 hours of multi-user sensor data collected from 21 sessions in a smart-home environment. MuRAL is annotated with fine-grained natural language descriptions, resident identities, and high-level activity labels, all situated in dynamic, realistic multi-resident settings. We benchmark MuRAL using state-of-the-art LLMs for three core tasks: subject assignment, action description, and activity classification. Our results demonstrate that while LLMs can provide rich semantic interpretations of ambient data, current models still face challenges in handling multi-user ambiguity and under-specified sensor contexts. We release MuRAL to support future research on LLM-powered, explainable, and socially aware activity understanding in smart environments. For access to the dataset, please reach out to us via the provided contact information. A direct link for dataset retrieval will be made available at this location in due course.",0.1596755282448681,0
arxiv,2504.20493,Token-Efficient Prompt Injection Attack: Provoking Cessation in LLM Reasoning via Adaptive Token Compression,Yu Cui; Yujun Cai; Yiwei Wang,2025-04-29T07:34:22+00:00,cs.CR,http://arxiv.org/pdf/2504.20493v1,"While reasoning large language models (LLMs) demonstrate remarkable performance across various tasks, they also contain notable security vulnerabilities. Recent research has uncovered a ""thinking-stopped"" vulnerability in DeepSeek-R1, where model-generated reasoning tokens can forcibly interrupt the inference process, resulting in empty responses that compromise LLM-integrated applications. However, existing methods triggering this vulnerability require complex mathematical word problems with long prompts--even exceeding 5,000 tokens. To reduce the token cost and formally define this vulnerability, we propose a novel prompt injection attack named ""Reasoning Interruption Attack"", based on adaptive token compression. We demonstrate that simple standalone arithmetic tasks can effectively trigger this vulnerability, and the prompts based on such tasks exhibit simpler logical structures than mathematical word problems. We develop a systematic approach to efficiently collect attack prompts and an adaptive token compression framework that utilizes LLMs to automatically compress these prompts. Experiments show our compression framework significantly reduces prompt length while maintaining effective attack capabilities. We further investigate the attack's performance via output prefix and analyze the underlying causes of the vulnerability, providing valuable insights for improving security in reasoning LLMs.",0.18929719628191888,0
