type,id,title,authors,date,primary_category,pdf_url,abstract,score,show
arxiv,2504.20998,YoChameleon: Personalized Vision and Language Generation,Thao Nguyen; Krishna Kumar Singh; Jing Shi; Trung Bui; Yong Jae Lee; Yuheng Li,2025-04-29T17:59:57+00:00,cs.CV,http://arxiv.org/pdf/2504.20998v1,"Large Multimodal Models (e.g., GPT-4, Gemini, Chameleon) have evolved into powerful tools with millions of users. However, they remain generic models and lack personalized knowledge of specific user concepts. Previous work has explored personalization for text generation, yet it remains unclear how these methods can be adapted to new modalities, such as image generation. In this paper, we introduce Yo'Chameleon, the first attempt to study personalization for large multimodal models. Given 3-5 images of a particular concept, Yo'Chameleon leverages soft-prompt tuning to embed subject-specific information to (i) answer questions about the subject and (ii) recreate pixel-level details to produce images of the subject in new contexts. Yo'Chameleon is trained with (i) a self-prompting optimization mechanism to balance performance across multiple modalities, and (ii) a ``soft-positive"" image generation approach to enhance image quality in a few-shot setting.",0.16386548287237407,0
arxiv,2504.20997,Toward Efficient Exploration by Large Language Model Agents,Dilip Arumugam; Thomas L. Griffiths,2025-04-29T17:59:48+00:00,cs.LG,http://arxiv.org/pdf/2504.20997v1,"A burgeoning area within reinforcement learning (RL) is the design of sequential decision-making agents centered around large language models (LLMs). While autonomous decision-making agents powered by modern LLMs could facilitate numerous real-world applications, such successes demand agents that are capable of data-efficient RL. One key obstacle to achieving data efficiency in RL is exploration, a challenge that we demonstrate many recent proposals for LLM agent designs struggle to contend with. Meanwhile, classic algorithms from the RL literature known to gracefully address exploration require technical machinery that can be challenging to operationalize in purely natural language settings. In this work, rather than relying on finetuning or in-context learning to coax LLMs into implicitly imitating a RL algorithm, we illustrate how LLMs can be used to explicitly implement an existing RL algorithm (Posterior Sampling for Reinforcement Learning) whose capacity for statistically-efficient exploration is already well-studied. We offer empirical results demonstrating how our LLM-based implementation of a known, data-efficient RL algorithm can be considerably more effective in natural language tasks that demand prudent exploration.",0.18711070438926963,1
arxiv,2504.20988,Hubs and Spokes Learning: Efficient and Scalable Collaborative Machine Learning,Atul Sharma; Kavindu Herath; Saurabh Bagchi; Chaoyue Liu; Somali Chaterji,2025-04-29T17:56:55+00:00,cs.LG,http://arxiv.org/pdf/2504.20988v1,"We introduce the Hubs and Spokes Learning (HSL) framework, a novel paradigm for collaborative machine learning that combines the strengths of Federated Learning (FL) and Decentralized Learning (P2PL). HSL employs a two-tier communication structure that avoids the single point of failure inherent in FL and outperforms the state-of-the-art P2PL framework, Epidemic Learning Local (ELL). At equal communication budgets (total edges), HSL achieves higher performance than ELL, while at significantly lower communication budgets, it can match ELL's performance. For instance, with only 400 edges, HSL reaches the same test accuracy that ELL achieves with 1000 edges for 100 peers (spokes) on CIFAR-10, demonstrating its suitability for resource-constrained systems. HSL also achieves stronger consensus among nodes after mixing, resulting in improved performance with fewer training rounds. We substantiate these claims through rigorous theoretical analyses and extensive experimental results, showcasing HSL's practicality for large-scale collaborative learning.",0.16129027676216032,0
arxiv,2504.20983,LTLf Adaptive Synthesis for Multi-Tier Goals in Nondeterministic Domains,Giuseppe De Giacomo; Gianmarco Parretti; Shufang Zhu,2025-04-29T17:53:16+00:00,cs.AI,http://arxiv.org/pdf/2504.20983v1,"We study a variant of LTLf synthesis that synthesizes adaptive strategies for achieving a multi-tier goal, consisting of multiple increasingly challenging LTLf objectives in nondeterministic planning domains. Adaptive strategies are strategies that at any point of their execution (i) enforce the satisfaction of as many objectives as possible in the multi-tier goal, and (ii) exploit possible cooperation from the environment to satisfy as many as possible of the remaining ones. This happens dynamically: if the environment cooperates (ii) and an objective becomes enforceable (i), then our strategies will enforce it. We provide a game-theoretic technique to compute adaptive strategies that is sound and complete. Notably, our technique is polynomial, in fact quadratic, in the number of objectives. In other words, it handles multi-tier goals with only a minor overhead compared to standard LTLf synthesis.",0.159516431342558,0
arxiv,2504.20980,Jekyll-and-Hyde Tipping Point in an AI's Behavior,Neil F. Johnson; Frank Yingjie Huo,2025-04-29T17:50:29+00:00,cs.AI,http://arxiv.org/pdf/2504.20980v1,"Trust in AI is undermined by the fact that there is no science that predicts -- or that can explain to the public -- when an LLM's output (e.g. ChatGPT) is likely to tip mid-response to become wrong, misleading, irrelevant or dangerous. With deaths and trauma already being blamed on LLMs, this uncertainty is even pushing people to treat their 'pet' LLM more politely to 'dissuade' it (or its future Artificial General Intelligence offspring) from suddenly turning on them. Here we address this acute need by deriving from first principles an exact formula for when a Jekyll-and-Hyde tipping point occurs at LLMs' most basic level. Requiring only secondary school mathematics, it shows the cause to be the AI's attention spreading so thin it suddenly snaps. This exact formula provides quantitative predictions for how the tipping-point can be delayed or prevented by changing the prompt and the AI's training. Tailored generalizations will provide policymakers and the public with a firm platform for discussing any of AI's broader uses and risks, e.g. as a personal counselor, medical advisor, decision-maker for when to use force in a conflict situation. It also meets the need for clear and transparent answers to questions like ''should I be polite to my LLM?''",0.16704774945148182,0
arxiv,2504.20970,SVD Based Least Squares for X-Ray Pneumonia Classification Using Deep Features,Mete Erdogan; Sebnem Demirtas,2025-04-29T17:39:16+00:00,cs.CV,http://arxiv.org/pdf/2504.20970v1,"Accurate and early diagnosis of pneumonia through X-ray imaging is essential for effective treatment and improved patient outcomes. Recent advancements in machine learning have enabled automated diagnostic tools that assist radiologists in making more reliable and efficient decisions. In this work, we propose a Singular Value Decomposition-based Least Squares (SVD-LS) framework for multi-class pneumonia classification, leveraging powerful feature representations from state-of-the-art self-supervised and transfer learning models. Rather than relying on computationally expensive gradient based fine-tuning, we employ a closed-form, non-iterative classification approach that ensures efficiency without compromising accuracy. Experimental results demonstrate that SVD-LS achieves competitive performance while offering significantly reduced computational costs, making it a viable alternative for real-time medical imaging applications.",0.15495856694148857,1
arxiv,2504.20964,OSVBench: Benchmarking LLMs on Specification Generation Tasks for Operating System Verification,Shangyu Li; Juyong Jiang; Tiancheng Zhao; Jiasi Shen,2025-04-29T17:34:49+00:00,cs.CL,http://arxiv.org/pdf/2504.20964v1,"We introduce OSVBench, a new benchmark for evaluating Large Language Models (LLMs) in generating complete specification code pertaining to operating system kernel verification tasks. The benchmark first defines the specification generation problem into a program synthesis problem within a confined scope of syntax and semantics by providing LLMs with the programming model. The LLMs are required to understand the provided verification assumption and the potential syntax and semantics space to search for, then generate the complete specification for the potentially buggy operating system code implementation under the guidance of the high-level functional description of the operating system. This benchmark is built upon a real-world operating system kernel, Hyperkernel, and consists of 245 complex specification generation tasks in total, each is a long context task of about 20k-30k tokens. Our comprehensive evaluation of 12 LLMs exhibits the limited performance of the current LLMs on the specification generation tasks for operating system verification. Significant disparities in their performance on the benchmark highlight differences in their ability to handle long-context code generation tasks. The evaluation toolkit and benchmark are available at https://github.com/lishangyu-hkust/OSVBench.",0.1661144854572842,0
arxiv,2504.20946,Trace-of-Thought: Enhanced Arithmetic Problem Solving via Reasoning Distillation From Large to Small Language Models,Tyler McDonald; Ali Emami,2025-04-29T17:14:54+00:00,cs.CL,http://arxiv.org/pdf/2504.20946v1,"As Large Language Models (LLMs) continue to be leveraged for daily tasks, prompt engineering remains an active field of contribution within computational linguistics, particularly in domains requiring specialized knowledge such as arithmetic reasoning. While these LLMs are optimized for a variety of tasks, their exhaustive employment may become computationally or financially cumbersome for small teams. Additionally, complete reliance on proprietary, closed-source models often limits customization and adaptability, posing significant challenges in research and application scalability. Instead, by leveraging open-source models at or below 7 billion parameters, we can optimize our resource usage while still observing remarkable gains over standard prompting approaches. To cultivate this notion, we introduce Trace-of-Thought Prompting, a simple, zero-shot prompt engineering method that instructs LLMs to create observable subproblems using critical problem-solving, specifically designed to enhance arithmetic reasoning capabilities. When applied to open-source models in tandem with GPT-4, we observe that Trace-of-Thought not only allows novel insight into the problem-solving process but also introduces performance gains as large as 125% on language models at or below 7 billion parameters. This approach underscores the potential of open-source initiatives in democratizing AI research and improving the accessibility of high-quality computational linguistics applications.",0.17881334493014658,1
arxiv,2504.20930,ChestX-Reasoner: Advancing Radiology Foundation Models with Reasoning through Step-by-Step Verification,Ziqing Fan; Cheng Liang; Chaoyi Wu; Ya Zhang; Yanfeng Wang; Weidi Xie,2025-04-29T16:48:23+00:00,cs.AI,http://arxiv.org/pdf/2504.20930v1,"Recent advances in reasoning-enhanced large language models (LLMs) and multimodal LLMs (MLLMs) have significantly improved performance in complex tasks, yet medical AI models often overlook the structured reasoning processes inherent in clinical practice. In this work, we present ChestX-Reasoner, a radiology diagnosis MLLM designed to leverage process supervision mined directly from clinical reports, reflecting the step-by-step reasoning followed by radiologists. We construct a large dataset by extracting and refining reasoning chains from routine radiology reports. Our two-stage training framework combines supervised fine-tuning and reinforcement learning guided by process rewards to better align model reasoning with clinical standards. We introduce RadRBench-CXR, a comprehensive benchmark featuring 59K visual question answering samples with 301K clinically validated reasoning steps, and propose RadRScore, a metric evaluating reasoning factuality, completeness, and effectiveness. ChestX-Reasoner outperforms existing medical and general-domain MLLMs in both diagnostic accuracy and reasoning ability, achieving 16%, 5.9%, and 18% improvements in reasoning ability compared to the best medical MLLM, the best general MLLM, and its base model, respectively, as well as 3.3%, 24%, and 27% improvements in outcome accuracy. All resources are open-sourced to facilitate further research in medical reasoning MLLMs.",0.1710955444414066,1
arxiv,2504.20924,A Domain-Agnostic Scalable AI Safety Ensuring Framework,Beomjun Kim; Kangyeon Kim; Sunwoo Kim; Heejin Ahn,2025-04-29T16:38:35+00:00,cs.AI,http://arxiv.org/pdf/2504.20924v1,"Ensuring the safety of AI systems has recently emerged as a critical priority for real-world deployment, particularly in physical AI applications. Current approaches to AI safety typically address predefined domain-specific safety conditions, limiting their ability to generalize across contexts.   We propose a novel AI safety framework that ensures AI systems comply with \textbf{any user-defined constraint}, with \textbf{any desired probability}, and across \textbf{various domains}.   In this framework, we combine an AI component (e.g., neural network) with an optimization problem to produce responses that minimize objectives while satisfying user-defined constraints with probabilities exceeding user-defined thresholds. For credibility assessment of the AI component, we propose \textit{internal test data}, a supplementary set of safety-labeled data, and a \textit{conservative testing} methodology that provides statistical validity of using internal test data. We also present an approximation method of a loss function and how to compute its gradient for training.   We mathematically prove that probabilistic constraint satisfaction is guaranteed under specific, mild conditions and prove a scaling law between safety and the number of internal test data. We demonstrate our framework's effectiveness through experiments in diverse domains: demand prediction for production decision, safe reinforcement learning within the SafetyGym simulator, and guarding AI chatbot outputs. Through these experiments, we demonstrate that our method guarantees safety for user-specified constraints, outperforms {for \textbf{up to several order of magnitudes}} existing methods in low safety threshold regions, and scales effectively with respect to the size of internal test data.",0.14007980449459329,0
arxiv,2504.20922,DYNAMAX: Dynamic computing for Transformers and Mamba based architectures,Miguel Nogales; Matteo Gambella; Manuel Roveri,2025-04-29T16:38:15+00:00,cs.CL,http://arxiv.org/pdf/2504.20922v1,"Early exits (EEs) offer a promising approach to reducing computational costs and latency by dynamically terminating inference once a satisfactory prediction confidence on a data sample is achieved. Although many works integrate EEs into encoder-only Transformers, their application to decoder-only architectures and, more importantly, Mamba models, a novel family of state-space architectures in the LLM realm, remains insufficiently explored. This work introduces DYNAMAX, the first framework to exploit the unique properties of Mamba architectures for early exit mechanisms. We not only integrate EEs into Mamba but also repurpose Mamba as an efficient EE classifier for both Mamba-based and transformer-based LLMs, showcasing its versatility. Our experiments employ the Mistral 7B transformer compared to the Codestral 7B Mamba model, using data sets such as TruthfulQA, CoQA, and TriviaQA to evaluate computational savings, accuracy, and consistency. The results highlight the adaptability of Mamba as a powerful EE classifier and its efficiency in balancing computational cost and performance quality across NLP tasks. By leveraging Mamba's inherent design for dynamic processing, we open pathways for scalable and efficient inference in embedded applications and resource-constrained environments. This study underscores the transformative potential of Mamba in redefining dynamic computing paradigms for LLMs.",0.17328686127710027,0
arxiv,2504.20921,Leveraging Generative AI Through Prompt Engineering and Rigorous Validation to Create Comprehensive Synthetic Datasets for AI Training in Healthcare,Polycarp Nalela,2025-04-29T16:37:34+00:00,cs.AI,http://arxiv.org/pdf/2504.20921v1,"Access to high-quality medical data is often restricted due to privacy concerns, posing significant challenges for training artificial intelligence (AI) algorithms within Electronic Health Record (EHR) applications. In this study, prompt engineering with the GPT-4 API was employed to generate high-quality synthetic datasets aimed at overcoming this limitation. The generated data encompassed a comprehensive array of patient admission information, including healthcare provider details, hospital departments, wards, bed assignments, patient demographics, emergency contacts, vital signs, immunizations, allergies, medical histories, appointments, hospital visits, laboratory tests, diagnoses, treatment plans, medications, clinical notes, visit logs, discharge summaries, and referrals. To ensure data quality and integrity, advanced validation techniques were implemented utilizing models such as BERT's Next Sentence Prediction for sentence coherence, GPT-2 for overall plausibility, RoBERTa for logical consistency, autoencoders for anomaly detection, and conducted diversity analysis. Synthetic data that met all validation criteria were integrated into a comprehensive PostgreSQL database, serving as the data management system for the EHR application. This approach demonstrates that leveraging generative AI models with rigorous validation can effectively produce high-quality synthetic medical data, facilitating the training of AI algorithms while addressing privacy concerns associated with real patient data.",0.13973272625587077,1
arxiv,2504.20910,When Testing AI Tests Us: Safeguarding Mental Health on the Digital Frontlines,Sachin R. Pendse; Darren Gergle; Rachel Kornfield; Jonah Meyerhoff; David Mohr; Jina Suh; Annie Wescott; Casey Williams; Jessica Schleider,2025-04-29T16:27:20+00:00,cs.CY,http://arxiv.org/pdf/2504.20910v1,"Red-teaming is a core part of the infrastructure that ensures that AI models do not produce harmful content. Unlike past technologies, the black box nature of generative AI systems necessitates a uniquely interactional mode of testing, one in which individuals on red teams actively interact with the system, leveraging natural language to simulate malicious actors and solicit harmful outputs. This interactional labor done by red teams can result in mental health harms that are uniquely tied to the adversarial engagement strategies necessary to effectively red team. The importance of ensuring that generative AI models do not propagate societal or individual harm is widely recognized -- one less visible foundation of end-to-end AI safety is also the protection of the mental health and wellbeing of those who work to keep model outputs safe. In this paper, we argue that the unmet mental health needs of AI red-teamers is a critical workplace safety concern. Through analyzing the unique mental health impacts associated with the labor done by red teams, we propose potential individual and organizational strategies that could be used to meet these needs, and safeguard the mental health of red-teamers. We develop our proposed strategies through drawing parallels between common red-teaming practices and interactional labor common to other professions (including actors, mental health professionals, conflict photographers, and content moderators), describing how individuals and organizations within these professional spaces safeguard their mental health given similar psychological demands. Drawing on these protective practices, we describe how safeguards could be adapted for the distinct mental health challenges experienced by red teaming organizations as they mitigate emerging technological risks on the new digital frontlines.",0.13828641675947978,0
arxiv,2504.20903,Modeling AI-Human Collaboration as a Multi-Agent Adaptation,Prothit Sen; Sai Mihir Jakkaraju,2025-04-29T16:19:53+00:00,cs.MA,http://arxiv.org/pdf/2504.20903v1,"We develop an agent-based simulation to formalize AI-human collaboration as a function of task structure, advancing a generalizable framework for strategic decision-making in organizations. Distinguishing between heuristic-based human adaptation and rule-based AI search, we model interactions across modular (parallel) and sequenced (interdependent) tasks using an NK model. Our results reveal that in modular tasks, AI often substitutes for humans - delivering higher payoffs unless human expertise is very high, and the AI search space is either narrowly focused or extremely broad. In sequenced tasks, interesting complementarities emerge. When an expert human initiates the search and AI subsequently refines it, aggregate performance is maximized. Conversely, when AI leads, excessive heuristic refinement by the human can reduce payoffs. We also show that even ""hallucinatory"" AI - lacking memory or structure - can improve outcomes when augmenting low-capability humans by helping escape local optima. These results yield a robust implication: the effectiveness of AI-human collaboration depends less on context or industry, and more on the underlying task structure. By elevating task decomposition as the central unit of analysis, our model provides a transferable lens for strategic decision-making involving humans and an agentic AI across diverse organizational settings.",0.14804355632447286,0
arxiv,2504.20902,Classifier-to-Bias: Toward Unsupervised Automatic Bias Detection for Visual Classifiers,Quentin Guimard; Moreno D'Incà; Massimiliano Mancini; Elisa Ricci,2025-04-29T16:19:38+00:00,cs.CV,http://arxiv.org/pdf/2504.20902v1,"A person downloading a pre-trained model from the web should be aware of its biases. Existing approaches for bias identification rely on datasets containing labels for the task of interest, something that a non-expert may not have access to, or may not have the necessary resources to collect: this greatly limits the number of tasks where model biases can be identified. In this work, we present Classifier-to-Bias (C2B), the first bias discovery framework that works without access to any labeled data: it only relies on a textual description of the classification task to identify biases in the target classification model. This description is fed to a large language model to generate bias proposals and corresponding captions depicting biases together with task-specific target labels. A retrieval model collects images for those captions, which are then used to assess the accuracy of the model w.r.t. the given biases. C2B is training-free, does not require any annotations, has no constraints on the list of biases, and can be applied to any pre-trained model on any classification task. Experiments on two publicly available datasets show that C2B discovers biases beyond those of the original datasets and outperforms a recent state-of-the-art bias detection baseline that relies on task-specific annotations, being a promising first step toward addressing task-agnostic unsupervised bias detection.",0.1574819216904232,1
arxiv,2504.20898,CBM-RAG: Demonstrating Enhanced Interpretability in Radiology Report Generation with Multi-Agent RAG and Concept Bottleneck Models,Hasan Md Tusfiqur Alam; Devansh Srivastav; Abdulrahman Mohamed Selim; Md Abdul Kadir; Md Moktadiurl Hoque Shuvo; Daniel Sonntag,2025-04-29T16:14:55+00:00,cs.AI,http://arxiv.org/pdf/2504.20898v1,"Advancements in generative Artificial Intelligence (AI) hold great promise for automating radiology workflows, yet challenges in interpretability and reliability hinder clinical adoption. This paper presents an automated radiology report generation framework that combines Concept Bottleneck Models (CBMs) with a Multi-Agent Retrieval-Augmented Generation (RAG) system to bridge AI performance with clinical explainability. CBMs map chest X-ray features to human-understandable clinical concepts, enabling transparent disease classification. Meanwhile, the RAG system integrates multi-agent collaboration and external knowledge to produce contextually rich, evidence-based reports. Our demonstration showcases the system's ability to deliver interpretable predictions, mitigate hallucinations, and generate high-quality, tailored reports with an interactive interface addressing accuracy, trust, and usability challenges. This framework provides a pathway to improving diagnostic consistency and empowering radiologists with actionable insights.",0.13946360560481985,0
arxiv,2504.20887,Return Capping: Sample-Efficient CVaR Policy Gradient Optimisation,Harry Mead; Clarissa Costen; Bruno Lacerda; Nick Hawes,2025-04-29T16:04:16+00:00,cs.LG,http://arxiv.org/pdf/2504.20887v1,"When optimising for conditional value at risk (CVaR) using policy gradients (PG), current methods rely on discarding a large proportion of trajectories, resulting in poor sample efficiency. We propose a reformulation of the CVaR optimisation problem by capping the total return of trajectories used in training, rather than simply discarding them, and show that this is equivalent to the original problem if the cap is set appropriately. We show, with empirical results in an number of environments, that this reformulation of the problem results in consistently improved performance compared to baselines.",0.161659466127219,1
